id,text,clean_text,eng
b'gAAAAABkk1GX0F8duzkJAVxxzM18ebcVna1R1bZJTXKfrREWvzGhEltqIIHtvLAl0NgMRhVvO9Ho5sWJeobH8ptWOGwXD5LwMxYPCie4KymLTBby0Y51e6E=',➡️ Alimentos caseros o procesados: ¿Qué tipo de comida es mejor para tu mascota? https://t.co/a6qqVXGb2H,alimentos caseros o procesados ¿qué tipo de comida es mejor para tu mascota,home or processed foods what type of food is best for your pet
b'gAAAAABkk1GXAlwFO_60QBSJB5L6l3kEEb5PxxHrDQ7zLR9JpQVVlM-zXU7-j5KVBDjRk07dnhkd5onCmCMSWyp_uIbPf5j_q2UWCBiqYgvM0J7IyvdiOz0=',🎲 La pregunta más difícil jamás formulada: ¿Qué es la verdad? https://t.co/AdVNQw3rpP,la pregunta más difícil jamás formulada ¿qué es la verdad,the most difficult question ever asked what is the truth
b'gAAAAABkk1GXgrUzRsJkpv_f67pYYAGO-2F_3xUpFZ637bU3iJYc8hWCb9JdhoWvvnYguijdmfSn8rHTI2dU1lPI4-XdlSfjrINDvBqNdj_xxIREnb1_wvA=',👉 Un clásico de los decks. \n\n💥 ¡Aquí tienes un link para mejorar el slide de la competencia!\n\n📎 https://t.co/eyPyjgOQm2 https://t.co/jlIXG4uskL,un clásico de los decks ¡aquí tienes un link para mejorar el slide de la competencia,a classic decks here you have a link to improve the slide of the competition
b'gAAAAABkk1GXaez73xt9pr6hr5PxZWnr88MfrXV2gkTLmLZgMH9oLwOqAH0KpB4fc77j_w9pWseBldZbFkGJYHnmi-r59hjbXe7c9YzM-NUQP17Be35ZRYY=',@_Futbolero_ @agarnacho7 En qué lugar os deja que el 13 de la liga haga lo que el líder no pudo?,en qué lugar os deja que el de la liga haga lo que el líder no pudo,where he lets you in the league do what the leader couldn't.
b'gAAAAABkk1GYR9VNsNXeIjot7JXiDmsyhDxle3S1wvHUq6PVGfj-UGDto4cDLAkqlk-db_9mCCYDcyOUtRYhfpuJVPC37m1ZGu9Xs-7d0likOR-x2VKxzW8=',🔴 El estrés en las plantas: ¿Transmiten su malestar a través de sonidos? https://t.co/E8u12CuXcb,el estrés en las plantas ¿transmiten su malestar a través de sonidos,stress in plants do they transmit their discomfort through sounds
b'gAAAAABkk1GYBhmosPrkSNvrAmua2T9oYCsNMBdMgTTrJmOWzk5zbufPyhMEDLMNTQ03sXqNtTFBsKXEa7QBgQMQXBVyy8QFe_0ywdLP3yyY5Rv1kBzmb9g=',"Me han informado del curso que quiero hacer: 2000€ euritos!!! \n\nA trabajar al burguer i guess 😎👍. Para que digan que siempre estás a tiempo de estudiar. Supongo que sí, si eres rico. \n\nY ojo, que yo he estudiado tres mil cosas para luego que de igual 🥲",me han informado del curso que quiero hacer € euritos a trabajar al burguer i guess para que digan que siempre estás a tiempo de estudiar supongo que sí si eres rico y ojo que yo he estudiado tres mil cosas para luego que de igual,I've been informed of the course I want to do €euros to work burguer i guess to say that you're always in time to study I guess yes if you're rich and eye I've studied three thousand things for then anyway
b'gAAAAABkk1GYopnW8nLrDoNvL-9U9AtYEPsuVqS5E0CHM3dlU9PP_1VndoZ-pzHorhvOL3shObHwOSsC3GRKZThd6F0BT87_1Q3baQZ-ilVZ0EIwSIspnmk=',📳 Estos son los insultos más usados por los españoles https://t.co/n7kg2h6dQt,estos son los insultos más usados por los españoles,These are the most frequently used insults by the Spanish.
b'gAAAAABkk1GYsarBIrjR0dITVqNhtNtZ1pjtiXe_9GLT7U_nN8Xhkh8CVx5eEzHfgYzvTXIBojyxCn53k_XvRyeYdzXN8ZBjwG4ZPbG9oc8f5y0Vb4-khX4=',"‼ Estas son las GASOLINERAS más BARATAS esta Semana Santa, provincia a provincia \n\nhttps://t.co/gOCfMOLVJs",‼ estas son las gasolineras más baratas esta semana santa provincia a provincia,These are the cheapest gas stations this week Holy province to province
b'gAAAAABkk1GYrEM3rDdCgAotU9h6NF2AM5GmMopBmazItveVxfAKqlcKsU3VUGBztoMOAxvebKDjx5BQqP2v9HgugntDO8tzrB8ysmlBkjTEWKHVJrfHEVI=',@AlexfusteAlex Hay personas que no   entienden según que terminología o conceptos y comprometido con la   #EducaciónFinanciera publiqué un artículo donde se explica  https://t.co/R7IATYwJcW,hay personas que no entienden según que terminología o conceptos y comprometido con la educaciónfinanciera publiqué un artículo donde se explica,There are people who don’t understand according to which terminology or concepts and committed to financial education I published an article explaining
b'gAAAAABkk1GYjB7UDHHt7IreVUo1ChAf7hQ_OT7a6Pmek4Qrr6GAQ6TU3KN2n2K3JNCR6f8qTcSebuuTCvhKifjpTO373INiJ68oWeFNMjgru5y6CzKlBSQ=',@aagarciamtz Amén 🙏🙏🙏❤️ hermosa oración 🙏,amén hermosa oración,amen beautiful prayer
b'gAAAAABkk1GYyY9vlYFCaM_87o8-nL-kTI0nW0ClhFa-EoDz6IB_t3T8TkOeWPUITA85lhgtZDDCEmd1qmhRXqJGIV8V4IdS_ObDmHhFEPCQRqAquZcDudI=',"@imtonysierra Más barato y más lindo, y con calidad. Porque no eligen otro país, papito.",más barato y más lindo y con calidad porque no eligen otro país papito,cheaper and nicer and with quality because they don't choose another daddy country
b'gAAAAABkk1GYlXPGTNs1uQG69hIlspezeKzTfelaF9Cp9Y6PNOTOEv6Si1GGkZOZCwHzT38RY1--XTEj97jXl7yQIhP13vodZjQfIHRgji663tqpYmUo6lc=',VAMOS ANSU VAMOOOS,vamos ansu vamooos,Let's go ansu vamooos
b'gAAAAABkk1GY4KbNCQc8FwKYMsRkr02FwdGTv3IzNJi64745m3Czmr12kcilVPDSxqwxmnySzzYIweeEvylusWH-jyldAVF4Cc2aLJ1zyX33KtQlVrGfkaA=',"Hay que venir a hacer el trabajo a los amigos de @saberyempatar. A @lalibreta no, lo de Zemo es OK. Pero @estoesunajena puede fichar a Mark Strong, si se compromete a algún cambio físico, y @futbolycine sería Rodolfo Sancho claramente. De nada 😂 https://t.co/jZPXS1l1NN https://t.co/ABnbUBthv4",hay que venir a hacer el trabajo a los amigos de a no lo de zemo es ok pero puede fichar a mark strong si se compromete a algún cambio físico y sería rodolfo sancho claramente de nada,you have to come to do the job to friends of not zemo is ok but you can sign to mark strong if you commit to some physical change and would be rhodolfo sancho clearly from nothing
b'gAAAAABkk1GYFhx7DSDVaR8EilfgPVSmDJHveZnN3Akt2IX_QMgyam7O4zdzlJgj27zEf4nHl9hFo7U7rHjdKjah1FHtfdKLhOCLnAXQd55eymkM7X-Lwt0=',"🍬 La historia del estadio Santiago Bernabéu, el 'Templo' del Real Madrid https://t.co/QnrpT4uJRR",la historia del estadio santiago bernabéu el templo del real madrid,the history of the stadium santiago bernabéu the temple of the royal madrid
b'gAAAAABkk1GYWwqQhkIbMb3Sb_xyVTpgy-dxR-lvQFNg9rqVBFT74MylutTsG2xA4Q2Nfcj6Hg_Gxa_LR4J3hro8PgvQZvV9FBQ7ULBsedaFJA_PQsQkhq4=',"@DrDhelizioso @DrMauricioGon @DrLuisServinde1 @tanycar @Lapalag Vete a la alberca, toda para ti",vete a la alberca toda para ti,Go to the pool all for yourself.
b'gAAAAABkk1GY2Wm9isePpmNX6YNQ50m8uG9aVD5cG1n-yiSs5KjU5YXGY24pKXX2gm-lLQV24vi1Gu5Z0fhpV6V7s5JZ83kGqAwI7LPLjpbEEBrClfF_pR4=',"🧩 Desde sus controvertibles prácticas en las Misioneras de la Caridad hasta sus dudosos modos de manejar el dinero concedido por personas igualmente turbias, en este artículo abordaremos en el lado oscuro de Santa Teresa de Calcuta https://t.co/HhHO8MLxkv",desde sus controvertibles prácticas en las misioneras de la caridad hasta sus dudosos modos de manejar el dinero concedido por personas igualmente turbias en este artículo abordaremos en el lado oscuro de santa teresa de calcuta,From his controversial practices in the missionaries of charity to his dubious ways of handling the money granted by equally murky people in this article we will address on the dark side of Saint Theresa of Calcutta
b'gAAAAABkk1GYl00cI0EET2iDSNrHtcj9GJlFdlvNd_l1SgpopCBq2wtl7nV0G7IlfiUVSvSuAgJu4w3K6u0kw-EldMTGmwWsFyxJk18csICXy14xdo4KkQs=',¿Ricos y creyentes? Esto es lo que dicen las principales religiones sobre el dinero https://t.co/WC1ki1VjG3,¿ricos y creyentes esto es lo que dicen las principales religiones sobre el dinero,is this what the major religions say about money?
b'gAAAAABkk1GYE_gtQyZOAlStFzaoTJuh7JC2WDjK9CzYWICLQ450m6OZB3iyeusFP24abxLzU8OQwE7N7-v3QGQz4Bry5FjvVsCl6WTtu-Zbb0Fcya5fwBg=',"🪁 Ludwig Zamenhof, el médico que inventó el esperanto https://t.co/YdRfU652Gs",ludwig zamenhof el médico que inventó el esperanto,ludwig zamenhof the doctor who invented Esperanto
b'gAAAAABkk1GYl828u5jVLphAJa7yOX9Z09YXmI5yGAYWA9ibWNt81Nod5rZLYUdmm7yxVrogEt2YDwygg1vjpZLEOoxWmROP-MulZj0ZUt6OHCRjHSMqnsQ=',"Por un tema mental, este es el partido que más quiero que ganen lo que va del año, incluso mas que vs Alianza.",por un tema mental este es el partido que más quiero que ganen lo que va del año incluso mas que vs alianza,For a mental issue this is the party that I want the most to win what's going on for the year even more than vs alliance
b'gAAAAABkk1GYHIHg6gyr9Q7kH_poZOvgcw3InGBrIkyAPFw1zh67cMsCY1suB9ziXyKlHstgT3GD4nAVBhngLL0ZkalbyYbPDr1GGD5l6tpnmdHEYe1UG94=',"@oscar_esp_ También tenía buen golpeo, encima nos hubiera sacado de encima a Rakitic",también tenía buen golpeo encima nos hubiera sacado de encima a rakitic,He also had a good hit on him. He'd have pulled raktic off us.
b'gAAAAABkk1GYJON8FTiZXqdEBsEWR91b_U5GOmJu2VJ7xQ3nUisBVF4rPnQ-c10zS6uUvpTJeznk2OvvaS0tAOTwsVAXGRYB1qv5SL9FmS64H5nVqS6IUUk=',"Un moro abusando de una mujer borracha en la parte de atrás de un Uber? \n\nSe que es en Inglaterra, pero donde quedo lo de “Sola y borracha quiero llegar a casa” de Irene Montero con este tipo de gentuza? https://t.co/Zw6LoTHy83",un moro abusando de una mujer borracha en la parte de atrás de un uber se que es en inglaterra pero donde quedo lo de “sola y borracha quiero llegar a casa” de irene montero con este tipo de gentuza,a moro abusing a drunk woman in the back of an uber I know it is in England but where I stay the “single and drunk I want to get home” of irenne montero with this kind of mob
b'gAAAAABkk1GYn_LJzroWGZYvze5W-aNRySp1iA5LakXMAvlt7CvxRtuZHnkIZqsjgsDAIxy1KL9osKoBTO-BTR4zibAyz8vOvF-a7kB7dzqGmhMtXAQTqWU=',"Qué ha hecho ? Querer darle una camiseta a una persona y comerse cientos de insultos por la cara ? \nComo hoy no tenían a Vinicius para llamarle de todo pues se han buscado a otro, lamentable. https://t.co/S6piBK6Ko0",qué ha hecho querer darle una camiseta a una persona y comerse cientos de insultos por la cara como hoy no tenían a vinicius para llamarle de todo pues se han buscado a otro lamentable,What made you want to give a person a T-shirt and eat hundreds of insults in your face like today you didn't have Vinicius to call you anything because you've been looking for another sorry one
b'gAAAAABkk1GYZPmhly1vKblFBK8JR7LkWHHCeAX0lD7YBFKVA8tItCxAsdFN81hQftCgLmfXhD9VKrOnSPtXfesIkBlpt6Z9uhSeYMGmLByVRXOWCN0OEZQ=',☑️ VÍDEO: Recupera las fotos y los vídeos que borraste de WhatsApp con estos sencillos pasos https://t.co/bp4pW6XDkA,vídeo recupera las fotos y los vídeos que borraste de whatsapp con estos sencillos pasos,video recovers the photos and videos you deleted from whatsapp with these simple steps
b'gAAAAABkk1GYrxRxd2WRqkqWIGG4niXXCA6ItWOlSiDR1-0FhTNNbn6FXE3AekH_sV775VeWSVnNmxYbUj4hThYUyQtwup7t4d1UDBgtx-z-3xMK8a7dA60=',"@29Val__ @eduardopenha @jcardonaleon @CamaraColombia Amigo, ese argumento ya lo destruimos. Si se acaban las corridas, fácilmente podemos reemplazar los 35mllns que es lo que donan, con eso no se sostiene un hospital. https://t.co/blRxXvWjB2",amigo ese argumento ya lo destruimos si se acaban las corridas fácilmente podemos reemplazar los mllns que es lo que donan con eso no se sostiene un hospital,"Dude, that argument is already destroyed if the runs are over. We can easily replace the mllns that don't support a hospital."
b'gAAAAABkk1GYQgBN_5-cXdzimFOeLvQoBUX5uFGLQjAabIyN8xyrYlfFH-sNflZTyM4AvydQCtqN5SzzXVGmWjWjhSU3QNws6RENWpYw9MZrXlgKComKC2c=',🎶  @lolaindigomusic CONFIRMA su COLABORACIÓN con @emimernes_ escrita también por Duki y FMK \n\nhttps://t.co/9NScc4NHyc,confirma su colaboración con escrita también por duki y fmk,confirms his collaboration with written also by duki and fmk
b'gAAAAABkk1GYFkEHtBgM-SlUMzWkLPshWc30WDeNCQ8tchPS8XGiN64xRpw8U6Tz_iy7gSneDqGFv_qR-43YOS8b7P512wlNovS1sJxGlCe1Sk7PcmpYxH4=',@_Adry___ No creo q haya hecho eso pq la consanguinidad podría hacer q la nena saliera con retraso o malformacion...crees q se arriesgaría?? El óvulo será de donante anónimo y el esperma del hijo,no creo q haya hecho eso pq la consanguinidad podría hacer q la nena saliera con retraso o malformacioncrees q se arriesgaría el óvulo será de donante anónimo y el esperma del hijo,I don't think I did that pq the consanguinity could cause the baby to come out late or misformation you'd risk the egg will be an anonymous donor and the son's sperm
b'gAAAAABkk1GYOSIKQgYG-P0RQtKCnsTdRCYGniIb8AqOZISpB6TALF24GE0jkY347G-Y9Mpuf1YuyatRYmc5uDWf8LqzHk1tzTleshctcpHOnL8ue-iKNLY=',"Estos son los políticos papanatas que tenemos bien sean del PP del PSOE o de lo que sea, están en la política para trincar a eso se dedican eficazmente https://t.co/NLZyeBA8ax",estos son los políticos papanatas que tenemos bien sean del pp del psoe o de lo que sea están en la política para trincar a eso se dedican eficazmente,These are the papal politicians that we have either psoe pp or whatever they are in politics to try to do that effectively.
b'gAAAAABkk1GYm7Q5vw336tP2WNHqEjMG25Ssc0fW7UE5sGzdo0GOnD4rBWjUPjhKTtd19S0fP4b3iLfN9LZjJq6c5AFW5Lba2LVjnjxX2v5wgROk9Prq1E4=',🛡️ Cómo los 'extraterrestres invisibles' podrían existir entre nosotros https://t.co/cE2hV7Ojcw,cómo los extraterrestres invisibles podrían existir entre nosotros,how invisible aliens could exist among us
b'gAAAAABkk1GYH-s7FK7CPCgUbDZ9UIS82GX_2jLqDOqMJfen9UFMrm02bSNBfwAATIodNOCQ82gZlZ9sb9hx9cMm1d0YbHKxVw42eK89OLiKM5VLWdlhAj8=',@lyydiagrv Ya eres más alta que yo,ya eres más alta que yo,You're taller than me.
b'gAAAAABkk1GYCXV20arbh4FM81vUdaMLJFJJVg9cYPALdLtVpdmbIjjj1F1BCHhTJia5A-X_W6maSADJ85gQI-eF_q_KJ7PCsg7tnmhv-OrzWT1Z08b3Pno=',"@Aldair_ems En que la producción eléctrica vuelve a ser mayoritariamente del estado. Y los beneficios económicos que genera esta producción no se van a España, se quedan en México y sirven para generar más infraestructura",en que la producción eléctrica vuelve a ser mayoritariamente del estado y los beneficios económicos que genera esta producción no se van a españa se quedan en méxico y sirven para generar más infraestructura,in which electricity production is once again mainly from the state and the economic benefits generated by this production are not going to Spain remain in Mexico and serve to generate more infrastructure
b'gAAAAABkk1GY78IsGH7cdpakTnyIhp47yaFd_H_w5gdFcM-3J2TAABdIOlejOZNHsL_VTdiRTD_-lEJKZwOQ16_4njGnpF3gMx1GTaWDsSXszEYBZl_PJDw=',Tb IU reclamó a @ComisionEuropea q frene la propos. de ley. Además solicitará q se reabra la solicitud sobre los acuíferos q el organismo q preside Dolors Montserrat cerró\nHubo otra sobre el almacén de gas con visita de eurodiputados en 2013 q concluyó con censura de la situación,tb iu reclamó a q frene la propos de ley además solicitará q se reabra la solicitud sobre los acuíferos q el organismo q preside dolors montserrat cerróhubo otra sobre el almacén de gas con visita de eurodiputados en q concluyó con censura de la situación,tb iu has demanded to q frene the proposals of law moreover will request that the request on the aquifers is reopened q the agency q presides pains montserrat has closed another on the warehouse of gas with visit of MEPs in q has concluded with censorship of the situation
b'gAAAAABkk1GYNRIsOlAtk_zjfYwYTEdUiPwvGzm9Xmx-AuswfTF785Co1kSrlB1bcRPWYPFPCDzbqIbVeF3OtCvvVXFZCuMscVjAEfpLCxVzOz1rTCDxUKk=',🔆 La ciencia moderna aún no ha producido un medicamento tranquilizador tan eficaz como lo son unas pocas palabras bondadosas (Sigmund Freud),la ciencia moderna aún no ha producido un medicamento tranquilizador tan eficaz como lo son unas pocas palabras bondadosas sigmund freud,modern science has not yet produced a reassuring medicine as effective as a few kind words sigmund Freud
b'gAAAAABkk1GYP8a970YjZFCwGgNXKrqtB_rWDf8Gcjojo-qg9oOHIhvbA3nErlbC4ex8OklRkFm3y7tRXW9u9WG5wXiGIeXGM1nLn0yPYwBSYPpPr06IZek=',"🎟️ Curiosidades sobre el Oso y el Madroño que probablemente desconocías, desde cambios en su locación hasta la polémica por el sexo del animal https://t.co/wbZmxp1YBw",curiosidades sobre el oso y el madroño que probablemente desconocías desde cambios en su locación hasta la polémica por el sexo del animal,curiosities about the bear and the madroño that you probably didn't know from changes in their location to controversy about the sex of the animal
b'gAAAAABkk1GYIkXKRfje1qowiIPHE1HyMoTwiVYvaGO0KRTacB7RcuStqRZwVGofrWghOxA8AqS79b39myoVtFBrU37CeZsqo8J5EGEx2l0bdEIVoLjWY6s=',"@mesubelatension Yo creo que estoy medio malo porque hoy, con el sol que hacía, he puesto la calefacción en el trabajo, y seguía con las manos tiesas. 🤧",yo creo que estoy medio malo porque hoy con el sol que hacía he puesto la calefacción en el trabajo y seguía con las manos tiesas,"I think I'm kind of bad because today, with the sun I was doing, I put the heat on the job and I was still stiff with my hands."
b'gAAAAABkk1GYTF9Nt4OmMzp5eiQ3qu1UZnIgJZlhPmU6J3tPR89XydC_8rGAFPjiDSJy0ybeE7aN-mUOAll1TLxLgPZqb7PgAn5PU9etqvT9DbauKe0HT7c=',"@sinisteree upamecano está en el Barça y tu y los seudoculés que le echáis mierda, estaríais matándole... hazte del madrid",upamecano está en el barça y tu y los seudoculés que le echáis mierda estaríais matándole hazte del madrid,Upamecano is in the barça and you and the pseudoculés that you shit him would be killing him become the madrid
b'gAAAAABkk1GY4UJ40UjdmxBVjfBxBO4iCvvPkTyqMjkatFdeHS8dZzoqEEvqGQ86MkRYAKUEeufMq1vIbLASrWZJUaaiATu0yIPHaKyUynhpRstcBArpsmc=',Algunas pruebas y cero dudas de que entre @ConcelloCoruna y #Xerión hay salseo del bueno.\n\n¡¡Queremos saber!! https://t.co/mCO3E5rCtO,algunas pruebas y cero dudas de que entre y xerión hay salseo del bueno¡¡queremos saber,some tests and zero doubts that between and xerion there is salt of the good we want to know
b'gAAAAABkk1GYE9a5_OjSw2Oy6SsedTzK07G4XuHvQCDBlxHu9xWPPGwEmV7k_GdMuB8yZu91kuMRa_QaDpXYXph48I6DPLKWGhYATCm8qWmdBUDMmnpVUKc=',💡 ¿Cuántos dientes tiene un tiburón? https://t.co/ctRAk0PgO9,¿cuántos dientes tiene un tiburón,How many teeth does a shark have?
b'gAAAAABkk1GYVegd8-9A5L7QCcsGJs5sMjcPxYiE-m5ixOkQoLbDPvjZRodix9c5Rd2E4oq-HDsmcWp8BQ0R9KJvvIvghony2rrTdvlULAlqzNH_TX8UjhU=',💎 Los 7 errores más comunes que cometen los ciclistas principiantes https://t.co/tqyUTK7Hjh,los errores más comunes que cometen los ciclistas principiantes,the most common mistakes that beginner cyclists make
b'gAAAAABkk1GYrqP9uXJDxt9A0YzpHNhSDzBBKvNXCub-uMvxfRGYT_Y00P2juDj3Gwm-Gso_cb61fCBuSIf0cPBwSINVxP1xsKo7d3Utx4JUsb85t-FJT88=',"💚🎶 5 canciones dance que deberías escuchar esta semana: Calvin Harris, Joel Corry, Sigala, Jonas Blue... \nVía @Los40Dance \nhttps://t.co/FPu6LFfvOn",canciones dance que deberías escuchar esta semana calvin harris joel corry sigala jonas blue vía,dance songs you should listen to this week Calvin harris joel corry follow her jonas blue via
b'gAAAAABkk1GYcq5CZfgxs4_Ky-vyF2XacOTF0IvyCToq_Xp76H--pP9rZQs3ARd6KRTB8H0zlM_T3pNhYx1eo_d0CAEemyMzNekB_gTigqvtnvBc6x-m8v4=',Mejibray es lo único que puede salvarme cuando estoy en decadence counting goats,mejibray es lo único que puede salvarme cuando estoy en decadence counting goats,mejibray is the only thing that can save me when I'm in decadence counting goats.
b'gAAAAABkk1GYhHWV5QS5KZTk032GHYDZOXHCf682qExExAgWsHpq0bUmRzWpQV0NaSwo48tqhMRDgPonU7Xukjy9NPd207lqA1_2aATU0XoqG6K1xpIkp7U=',"@juralde @Teresaribera @JuanMa_Moreno #Sequía @esXrebellion @EsRebelCientif @sanchezcastejon \nTan descabellado sería cambiar la hierba de los campos d golf por otro material seco, no contaminante? Cada año habrá menos agua, por bastantes décadas. Es momento de cambios drásticos. https://t.co/sWbZ7HNxe6",sequía tan descabellado sería cambiar la hierba de los campos d golf por otro material seco no contaminante cada año habrá menos agua por bastantes décadas es momento de cambios drásticos,drought so wild would be changing the grass of the golf courses for other clean dry material every year there will be less water for many decades it is time for drastic changes
b'gAAAAABkk1GYexj_aPuO1EuDkThJgPACWN-hthV2POJwuNLdhU-0FwABb3tkdHRqZ-MQtT6NStxVxds6IdoB22FbhDIIJ1KasHx6RLoNzkzMwtGf2tyer9Q=',La ‘teoría de la estupidez’ de Bonhoeffer: el estúpido suele ser más peligroso que el malvado https://t.co/cPcOOmZGN9,la ‘teoría de la estupidez’ de bonhoeffer el estúpido suele ser más peligroso que el malvado,the ‘theory of stupidity’ of bonhoeffer the stupid is usually more dangerous than the evil one
b'gAAAAABkk1GYZc2f8SyA0X60n5KRLe6Vvmz_TpuqjHDsKe5Tb8m_fjOoZyFPxsXe6wdVjS6pnXhMcMlmDKQFgGDYBVCvuMq6zPjh27pl4-Wy59qSt_QsyfI=',Los vestidos de Escarlata en Lo que el viento se llevó 😍😍😍😍😍😍😍😍,los vestidos de escarlata en lo que el viento se llevó,the scarlet dresses in what the wind took away
b'gAAAAABkk1GYx5yBrHYJUDUzOfuXWuflU75OliYY1KEX-mlapQBaJgI1TUwT48soL7YnNmm2I-YYvi35eX48DnXPL2CGLqe3TWjqkFTHZVN_gYnRIy1K6fg=',"No, señor Gallardo, el CO2 no es contaminante... Cierre las ventanillas y aspire por el tubo. https://t.co/OmrutuVpQK",no señor gallardo el co no es contaminante cierre las ventanillas y aspire por el tubo,No sir gallardo the co is not contaminating close the windows and aspirate through the tube
b'gAAAAABkk1GYLfp6vNLudYaF8C4Pozd_u2qGiIB7KB_74B8Ey7lfFPxD3eC8bkvF0Jg06T-b1Y8rWuZX3GCsGJa1rSbDs46O7PwyvMub7M6Vu3ucLTKv6yE=',🧩 El truco (según los científicos) para eliminar el arsénico del arroz sin que pierda los nutrientes https://t.co/EuKXURfq8A,el truco según los científicos para eliminar el arsénico del arroz sin que pierda los nutrientes,the trick according to scientists to eliminate arsenic from rice without losing nutrients
b'gAAAAABkk1GYlR2WC3iwcxsXdb3DLnqnUNZGwkPrvtmevHrv3J2nnM3Dd1AyuvXDAnLGinY8nPpWt6Gwx0AM6OSgdOFF3NNbot3tMNX9SbUa05u36MdkAW8=',🌀 Científicos tienen malas noticias para las personas con ojos marrones https://t.co/psut7LvASC,científicos tienen malas noticias para las personas con ojos marrones,scientists have bad news for people with brown eyes
b'gAAAAABkk1GY0rD_1mihVPo6iXSmTC-UBmgi8nSrekJ_j0kv4l73pT2NJJR2qpWPpfbmVbQB4XuMSaQ2HXtn03uPbvMeLhDZRWYatS9Ma-Nh_DaQOwnVisA=',@AXN_Espana Y veremos qué pasa con lo de la hija… me tiene muy pero qué muy intrigado…,y veremos qué pasa con lo de la hija… me tiene muy pero qué muy intrigado…,"And we'll see what happens to the daughter... she's got me very, very intrigued..."
b'gAAAAABkk1GYYCqe5XnpvZS0JiIi_Lw_7KUwmuEz9ZNv7zls3BRRa0oyWCMs-VZM7QqDD9s4x-38W6VPtOukJ8jqZiua8rexa0V3deNrRpAn5fVKVz_1-jk=',@DalasReview el primero está god mi king,el primero está god mi king,The first is god my king
b'gAAAAABkk1GYB3NNneZ-TW7sjgahakpxj31IvCDTU7aGc_XSa5OSGrN4CwceKapnyBUcHfzQ14OYHXUCLT34chcABngDrymLqBc8IusQq4Gv7Q50iJ01ybo=',"@InformaCosmos Qué horror!!! A ver, como en el futuro se libran de todos estos disparates en el planeta, concedidos por los corruptos políticos a las codiciosas empresas .",qué horror a ver como en el futuro se libran de todos estos disparates en el planeta concedidos por los corruptos políticos a las codiciosas empresas,What a horror to see how in the future they are rid of all these nonsenses on the planet granted by corrupt politicians to greedy companies
b'gAAAAABkk1GYh8U5o5KFZyMjGMlpdrEX75laYSCvtFvrud958K1bboOUrmVu2VQ0angkdbc44IBCjZrQLPzdNMDyGkMSymcYh1AbaVRAiXtT25lwCA4l2Iw=',"@valentine_fey ¿Por qué generalizas? A mi no me representan estos actos.\n\nY porque llamas ''corrupta'' a la afición? Lo del Caso Negreira no involucra a la afición y es más, a mi por ejemplo me da vergüenza todo lo que ha pasado.",¿por qué generalizas a mi no me representan estos actosy porque llamas corrupta a la afición lo del caso negreira no involucra a la afición y es más a mi por ejemplo me da vergüenza todo lo que ha pasado,Why do you generalize to me do not represent me these acts and because you call the hobby corrupt the negreira case does not involve the hobby and it is more to me for example it shames me everything that has happened
b'gAAAAABkk1GYbtPv124yqn6OzkhYKCfJFGejglXx-hW2UVC38ickt-x4RxW7r-YEHEbVbgn3pEWt31QiGo3bTZHsZa-Bsj1GPwVZ8aIJcs4AnACwzK3iC8c=',@lagatoteca Aquí Spock y sus besos rasposos 🥰🥰 mucho ánimo!! https://t.co/2zz9vvRCUV,aquí spock y sus besos rasposos mucho ánimo,here spock and her kisses raspositos a lot of encouragement
b'gAAAAABkk1GYRdRWZxw4hrntc6RZkXrAxI4j23UUyCHp7uJ0Vw_-cVphEfF90hM32oFZDpuiTYo0oNqL4xIErlkyYo-8TO4xRzCXo3hG2TRcPDux39fygrM=',La inversión a ultra largo plazo requiere una estrategia bien pensada y la elección adecuada de activos es clave. \n¿Seguirán Apple y Google en la cima en 2050? \n#inversiones #largoPlazo #Apple #GooglePay \n\nhttps://t.co/JLaBXwLAPI,la inversión a ultra largo plazo requiere una estrategia bien pensada y la elección adecuada de activos es clave ¿seguirán apple y google en la cima en inversiones largoplazo apple googlepay,Ultra-long-term investment requires a well-thought-out strategy and the right choice of assets is key. Will apple and google continue at the top of long-term investmentsapple googlepay
b'gAAAAABkk1GZGBJgNlvAkA-s_V5wnEfCytFK2SukObPHykpV4gRDZV3j2D9gUJqloNJKVfF6O3ZZhkoIxvRdniyMvNDkoloQ18WjKDRp6f1YyRl6LzUK7lo=',"Si en el primer beso, al cerrar los ojos, vez como fuegos artificiales, puede que haya una buena historia…",si en el primer beso al cerrar los ojos vez como fuegos artificiales puede que haya una buena historia…,If in the first kiss when you close your eyes once as fireworks there may be a good story...
b'gAAAAABkk1GZFkoOSrmS-fGwyBu8Rb91U6-nrElxChZixLoztiZxaN_F2ZN5dTKY9uWiXj2MQQRyMqQGrQxwY54Qzwj0jssakhErncPtXc_HVS04Au3ECzU=',🌐 ¿Qué le pasa a tu cuerpo si sales a caminar todos los días? https://t.co/AJmEMn86q1,¿qué le pasa a tu cuerpo si sales a caminar todos los días,What happens to your body if you walk every day
