id,text,clean_text,eng
b'gAAAAABkk1GdqEJaCOpD9IU6RdmGmxvvFt9pl28g_eRgna4MgYxvqVOli_fRoMJ5tmiWKhPkslkksSa2lX9qCE24uIAa7WisnSu-p6JaqHEH2EpOLtAE-HU=',@J0ui_ @a1krag Si hacemos alguna bootcamp tenemos opción Just Dance o Let's Sing 🤔,si hacemos alguna bootcamp tenemos opción just dance o lets sing,if we do any bootcamp we have just dance option or lets sing
b'gAAAAABkk1GdJRD3uX3KUeJHcNm8M2Eva6sXTOdPNzeQgVJzqIX6hFsbuepkRMXG1Euz0v5jQQxm8kvnxrVZuLbIPTf-u9DOk3nT2JKaE-aMlgrZN5D1lIQ=',"🌀 El trabajo es una parte esencial del ser humano, y los robots no se lo quitarán https://t.co/ZzixuQsvfX",el trabajo es una parte esencial del ser humano y los robots no se lo quitarán,work is an essential part of the human being and robots will not take it away
b'gAAAAABkk1Gdr-hZYpIyIrMZfI4gEOCwu5r1Sdyj6zIyVfB8y46I2sMDJ9aAmxZTud9K7NAkUPCT8Yg-AYMzgIxM1xnsuVdpB2CJjaZo2lRzCbt7TDhNUCI=',@camiloscapin @alexbbaena Siendo uruguayo no te conviene mucho hablar de segundones 🤣,siendo uruguayo no te conviene mucho hablar de segundones,"Being Uruguayan, it's not very good for you to talk about secondons."
b'gAAAAABkk1GdXgnhQq7-AtkBkdgWGu0st0tG-yLUENz5ZCNN0CNpZy9s-DeytjcPcINdEhe0mcjVC1tnW2pPFOifLi4uZ_GTtPk1bHIuoqoG10FqKIt7y_U=',@SEGUEROS Precioso el logo de Sega 🌈,precioso el logo de sega,beautiful the logo of mowing
b'gAAAAABkk1GdzlJTvv1ZnvfvRlgxKPaypBMSAl06m8ihMRRw1Rcc-N8jWi_ZHZz8WMjGffqaNGRc9b_60LXXYBufZMGTu6F4NRpVCNkmtWN7sbbuWHikIvE=',Las burradas que estoy leyendo en las respuestas de este tweet no son ni medio normal... https://t.co/D1WdmJ9yRf,las burradas que estoy leyendo en las respuestas de este tweet no son ni medio normal,I'm reading in the answers to this tweet. It's not half normal.
b'gAAAAABkk1GdQnotnsnSUNvxfT9r-_YhGoEjYXcQZFVxEucSNb5pYhMjy0Szqq02qLYw27qKI7HNDzADghWV16GLDNAsyCc6JLOJgob_ieF2vhy4Sh75ifg=',♾ Cómo contestar en privado a un mensaje de un grupo de WhatsApp https://t.co/mUyTEOsHZF,cómo contestar en privado a un mensaje de un grupo de whatsapp,how to respond in private to a message from a group of whatsapp
b'gAAAAABkk1GdQmHp6UAxZ81dtxE5_kxgaZiAw2QrWaj1io2cYQZ1VmVyf4x8atRxClMW8Rl1ryfNmRcbiT1SHsVhJ8Fp5WmNp2ruBPj8vEt6pJRkCyX4Ugw=',@balondeororaul @SuperPizarro @alvaro_velasco Maradona entrenó a los dorados de Sinaloa. Lo que el cuerpo es capaz de llegar a producir.,maradona entrenó a los dorados de sinaloa lo que el cuerpo es capaz de llegar a producir,maradona trained the goldens of synaloa what the body is able to produce
b'gAAAAABkk1Gd1xgP2chntwuN7ChcIg9iEGJ8ujb4pYhuSZsQUCubFiYQgX-liVAMJCnPVe6vQqbhtdqE9JZlXnRfvW3Rkh3sewNA1tg2laj3Dr2g2Rzfq6E=',"☑️ ¿Fue Judas realmente un traidor, o un colaborador clave en el plan divino? https://t.co/a86lPUqApt",¿fue judas realmente un traidor o un colaborador clave en el plan divino,Was Judah really a traitor or a key collaborator in the divine plan
b'gAAAAABkk1Gd8igsvdozYtm_sGB7M2JyCcgAKXGr4mIRZb1nz-0oCEfFtXM07FmSmLNBv9cupOgRJihweviUjhhRb3FVVkM4b60OCMVODPWCF657gmnY_3E=',@XaviPortales En el artículo está la información.,en el artículo está la información,in the article is the information
b'gAAAAABkk1Gdp6kc-x_FE958SUAnnZ5jbP4s2DHrukLdHMXYLXs7qgk-jU-k9jZS8RIojZy8gLhNhD0NDGD_X5sdga7WnrCZgl9FjUxRAql0eoofjxCKDmM=',"“Mantén tus ojos en las estrellas, y tus pies en la tierra.” – Theodore Roosevelt",“mantén tus ojos en las estrellas y tus pies en la tierra” – theodore roosevelt,“Keep your eyes on the stars and your feet on the earth” – theodore roosevelt
b'gAAAAABkk1Gdx12RuXuP2ry2YBrzLGTY2BeU8NpG0ag7pJw8W-ETzaShSqmjVXEjYWs7RnEnxGZx6HsUQP2v8YK-fLv0LAqUWOxS-fvrEH3tuEsCLHBP-Jo=',"🗓 El 25 de abril, @esc_europea_emp dará una sesión especializada sobre 'Etiquetado. ¿Qué tener en cuenta desde el punto de vista de la nutrición?'\n\n👀 Con el código HUB15 tendréis un 15% en todas sus formaciones: https://t.co/ayloiy3l9g\n\n👇 ¡Apúntate ya!https://t.co/y4MdGWm43K",el de abril dará una sesión especializada sobre etiquetado ¿qué tener en cuenta desde el punto de vista de la nutrición con el código hub tendréis un en todas sus formaciones ¡apúntate ya,the April will give a specialized session on labelling what to take into account from the point of view of nutrition with the code hub will have one in all its formations already
b'gAAAAABkk1GdAEkhZ31EzLvZOaQXqYDl1VIzzvOb7FXbka5GlxsEkXWIImJ3XSp_LPfHBQ8Mc6F4q0MWRMwYDkfJr-frhLK4X7KESNILwKbfKUWyo1f3-e4=',🚧 El Caballo de Troya: ¿Metáfora o máquina de asedio? https://t.co/aiU5mhUgvr,el caballo de troya ¿metáfora o máquina de asedio,"the troya horse, metaphor or siege machine"
b'gAAAAABkk1GdNAmsBAJBvRHDhIwD7XF74-1vIEUV5IcmjlCjlbuLnYihR55I-yJ6unKQytn71h7tSehqzY7jexfdUDUaIdo0jBh8N0MB9KKDROyzzoV1eNY=',prefiero mi paz mental,prefiero mi paz mental,I prefer my peace of mind
b'gAAAAABkk1GdMELoxP4LvUnhhqs1fuG333dzWXigw6C_NUD77FOxB-6VkDVbzkfHfX6jlPZveniw_uq1XcYVymvOXkHa5Vj0kXG7xHA-OmOHiR87W0BMNlI=',🔴 No hay un inventor en concreto que merezca el crédito exclusivo por la invención de la televisión https://t.co/papVKeiw5A,no hay un inventor en concreto que merezca el crédito exclusivo por la invención de la televisión,there is no particular inventor who deserves the exclusive credit for the invention of television
b'gAAAAABkk1GdCcz2ZV7H8gPQ8c70zNqCMCMBS1ZmjeYE2-Kngr97AhEorAT6KK1G8sAy7962LQ_f22hshNd0Tsu8aRb7qAgNxDg8_HIgOCb90_oVeK9YxWY=',"Bastardos , hay sitio de sobra pero claro ellos llevan placa y pipa , el asco más profundo https://t.co/1D8jGUba82",bastardos hay sitio de sobra pero claro ellos llevan placa y pipa el asco más profundo,Bastards have plenty of room but of course they carry plate and pipe the deepest disgust
b'gAAAAABkk1Gdf6VKLqwbVNQ0ltx7FMhxBmZVOJqyKBS6NGlCQXgCKKYsly2yySh3RREw2dEgDjY-EAq9-P0uKbC18EbfC_w1wHXz0_30hTO1-RqeKDL9OFg=',🧭 Las tecnologías que permiten ver a través de las paredes https://t.co/TxL6jBjarS,las tecnologías que permiten ver a través de las paredes,technologies that allow you to see through the walls
b'gAAAAABkk1GdNKVD-STuR9HQ6D3DcHcjqZnAe0oBjmuZEOChKkooLHPyMRuAZ1TIjIg-C33mq5ezR0X2VrR5FP59HkTeXNxOc4AUTMiNZTHcbKaK1K0AqSU=',"Los desafíos de futuro de @lorealspain: seguir reduciendo el uso del #plástico del proceso de producción. Lo cuenta Juan Alonso, Director General de L'Oréal España, en la #revistaCorresponsables71 👉 https://t.co/oqR3V5b04R https://t.co/GFfJcRi1X6",los desafíos de futuro de seguir reduciendo el uso del plástico del proceso de producción lo cuenta juan alonso director general de loréal españa en la revistacorresponsables,the challenges of the future of further reducing the use of plastic of the production process tells juan alonso general director of loréal spaña in the magazinecorresponding
b'gAAAAABkk1GdGiScsQTJyqT-P9Q7m-6SmG9XXfpsis8AjSMY83c0LYuBVGqH3lWDL2lA8HmS3v49o0zwI8l5fXvUKfAI-L1vUm7cuFNF4duMxeb8HxzPO_Q=',@superzotax (‘Me se’ acabó el ‘tecsto’),‘me se’ acabó el ‘tecsto’,‘I know’ finished the ‘detect’
b'gAAAAABkk1GdQ82TN5pYO9RGKqWUIsUccjsyzzC7WqCywao7iN6IVPxnP8TBi_gMvsqwaWwvqY2I3-JIhUCnZggwbGSebRb7GCYipsNNVej-BD9eW1rra3c=',@pablolebedinsky Los que nos movemos en bici no somos responsables de la inutilidad de nadie.,los que nos movemos en bici no somos responsables de la inutilidad de nadie,Those of us who ride our bikes are not responsible for anyone's uselessness.
b'gAAAAABkk1GdnQaCM6Zg_Gawvdy8Zn24gsQDF-4htKMAdS4xnnDirg_Fgzy9Q7eL9YSgO9QSL66_XQtwueh64_NTPr7sVn_38bKjTOBXzXCULhNUowOncc4=',Upamecano. Movistar ho té clar.,upamecano movistar ho té clar,upamecano move ho tea clar
b'gAAAAABkk1GdAFwiuMz341jJZGE7ygGhije4dcasiTpksq0jJRV7iMO7FOY0Be_5_6-dX6r2PK_-tXxMyEdEw5wFQUl-94XxMwgEvTFFruDwJugV88_Wi94=',que bien me caen los virgo 🫂,que bien me caen los virgo,that I like the virgo
b'gAAAAABkk1GdWdBrdWv6mppXviKHIAJLl3dK0gWUqoXUDSipJo2Weynse70i6i1K_ENoLuw_UjawyS93gdToFHATKVW6A8on3_nrZtbZiviINdH1KLugMEE=',¿Recuerdas algún juego de la Super Nintendo? https://t.co/nKNqGgarCy,¿recuerdas algún juego de la super nintendo,Do you remember any game of the super nintendo?
b'gAAAAABkk1GdPTTJ-SoSCh1ohEU1tdw8xWMbrxMTXpdPpSxpSYHtmmdJsijXb45Rs017RuGY8Fj8ZycK4YcD7FoI1AMTzwBNQzhoCu10hzcG3wp158jIO7Q=',Un mp3 de toda la vida https://t.co/href95VGSN,un mp de toda la vida,a lifetime mp
b'gAAAAABkk1GdCjwqEnjpxFp5tMFiHbOUrjXHVFuU3M953aPXJVVz8wA2XZ27h4CgvHkRuYASTVeUaW1nb0ly3ie4aD4DJcVAJF5s8zODXUdw-ggkXOEKSM0=',Te llevamos de ruta gastronómica por Asturias @TurismoAsturias @casaramonoviedo @TierraAstur @chef_lararoguez @VarsoviaGijon @oceangijon @Yumegastro #conmuchagula #asturias #gastronomía https://t.co/rMhowLht55,te llevamos de ruta gastronómica por asturias conmuchagula asturias gastronomía,We take you on a gastronomic route through asturias conmuchagula asturias gastronomy
b'gAAAAABkk1GdlK9hXiRm47KamC_lpmEH34Sxg_ByDVPK12ubYBxYUA8hKQqEYyyrPni8mKo4xo45q58BqAvBNOONzdD_ikv3x-1Y_8RMtz5r1jdm_PAMmOM=',@alfredoduro1 @fedeevalverde De momento el ya ha derribado a Baena... La violencia no se puede blanquear..,de momento el ya ha derribado a baena la violencia no se puede blanquear,For the moment he has already knocked down baena the violence cannot be laundered
b'gAAAAABkk1GdTnPyisBCaKYZGKTxPHkPCAL_2huLvQnmsql2PCttnkCydZYZXFAudQxLjzy7dCCVQR0uvOq4cwehBkHort6PGsoMumv_VYt4DlhCox2zunc=',@_bor08 Claro eso es lo que me había confundido,claro eso es lo que me había confundido,Of course that's what I was confused about.
b'gAAAAABkk1Gd_3ks2xlkiLySpwK8EDXu6IEB8-KeqnscmyByXH-Zb0Db3_pX00m9quUAsUsGlWfF4_wFxh10RnxuFhz3MCMoq7_ROvCd4W3ogzIVF5MaR70=',"♾ La asombrosa vida de Kobe Bryant: Éxitos, tragedia y un legado eterno https://t.co/xdrDJI0bqH",la asombrosa vida de kobe bryant éxitos tragedia y un legado eterno,the amazing life of kobe briant success tragedy and an eternal legacy
b'gAAAAABkk1GdTPY4XXHHJHF0PrUSLKrnrc-TzYDO7wt0WKxa3z0t_qIl6ZzeQ7HxFuSmqr2YGoZEnP81TIIIosrm34uXAANfdRFbhr7J8JvkN3xsnIVZ7Us=',"@Endikmaister @nostalgicpablo Y del Real Madrid...no falla, todos con el mismo perfil.",y del real madridno falla todos con el mismo perfil,And the real madrid fails all with the same profile
b'gAAAAABkk1Gdey3jOgqDZ9BuR4qeI1TK5rR2FZsZxV-iX3n9HAWh7KggkDY6CzhaoQGY2x6nu2xHY5CVFC-weaMsx0t_nsNOOMyCCzaoPAhpQhcIqOcG1gc=',🧩 La historia de la creación de Nueva York https://t.co/Gz3AhCjNLJ,la historia de la creación de nueva york,the story of the creation of new york
b'gAAAAABkk1GdaQlozva3FZmHVXxfS4XqHqj5ZTgXdQbKz1mk06CuFZrCNiXsL_go1OFOIEIBYz-_Nydf14n29d2n79wE0ZXErKnSBxuhX5GtQw7kN1ibPuE=',"Y esto que parece que lo digo por Sumar, que a mí personalmente ni me va ni me viene, soy votante de la CUP, va por la vida en general y el veganismo en particular",y esto que parece que lo digo por sumar que a mí personalmente ni me va ni me viene soy votante de la cup va por la vida en general y el veganismo en particular,And this thing that I seem to say for adding that to me personally I'm neither going nor coming I'm voting for the cup goes for life in general and veganism in particular
b'gAAAAABkk1GdlFzTibR0SLN5flr-8FNT07OnWtDNFj5-Cu_nCxrwRTL751Oa93STOz0RWDOYHABHZWAPcnMqqlA8QXT1j4VJZVoF1NKReMqr9q4qMIQOKCg=',🧲 Hay 4 tipos de ‘acaparador digital’. ¿Cuál eres tú? https://t.co/Qb5omi5T5L,hay tipos de ‘acaparador digital’ ¿cuál eres tú,There are types of ‘digital shutter’ which are you
b'gAAAAABkk1Gdw-xJMVqVEkzkSNrnZ9gBYV2v1Xumhrl4IJIpVBXb7L2rtYEuznqv9_TkDQBG6Sldc3G6M-NxVxXuO0gOjjnqFa5zl1xoCFCDSX9d4Yh4qjg=',⚓️ ¿Es tan mala la leche de vaca como la pintan? https://t.co/pzNhMK0kEE,¿es tan mala la leche de vaca como la pintan,Is cow's milk as bad as they paint it?
b'gAAAAABkk1GdnDv39BUAOIg13GxqcBpO7euK5NGeV80_21FrEznq3E5HiA75UmGOIOrN147eygi1GNmv8gUq1HqLYYN2acKOpvQmHdiqvSnxc_VA3Pjm6bA=',🪂 INVESTIGACIÓN | ¿Por qué experimentamos dolor de cabeza si el cerebro no siente dolor? https://t.co/WUS6s5vXkt,investigación ¿por qué experimentamos dolor de cabeza si el cerebro no siente dolor,research why we experience headache if the brain does not feel pain
b'gAAAAABkk1GdUo-6zJlyBSAqo_zSzA_DtcPIgG04YzsCeZXGV5iE1QnL-nJl3OAf24D2RBFnh8zRSBQwoBjMe40QVe0snD7rlPUUWcFgTJMNx1kIKGp8d74=',@msarodiaz Estaría bien que @fergodani aclarase qué propuesta defiende. Si la de Zuloaga o la que defendía él hace poco de convertirlo en espacio verde. Es tremendo que se acabe con lo que podría ser una gran área verde en Santander para construir. Con la de suelo urbano que ya hay.,estaría bien que aclarase qué propuesta defiende si la de zuloaga o la que defendía él hace poco de convertirlo en espacio verde es tremendo que se acabe con lo que podría ser una gran área verde en santander para construir con la de suelo urbano que ya hay,It would be good if you could clarify what proposal you defend if the one of zuloaga or the one that he defended recently from turning it into green space is tremendous that you end up with what could be a great green area in santander to build with that of urban soil that already exists
b'gAAAAABkk1GdMtfRiWcC9EfZHRHvbaEJRjv-bdx4qzn8iMELjnEusgbcYDlr18ME5GoGjc_n5f3DmotTcebzfkrPI0oQIUoaatnSeYGbIFGXQiXeBEWR-tw=',Que no sabes cocinar. No pasa nada. https://t.co/CJ4E2uU0o5,que no sabes cocinar no pasa nada,You can't cook. It's okay.
b'gAAAAABkk1GdpWACM-T19Z0zMXsfgKKugUDj23lz0VAxrjoOY4eIrTfVyFYTE9KWQKcMqjLUcRKZBJstLKNFYKt9buK6lnLfIQlCAASssCTPlykR9cb75x4=',Yankees siendo yankees\nQue los duerman ya. https://t.co/oy5CZ2r3lf,yankees siendo yankeesque los duerman ya,Yankees being Yankees get to sleep now
b'gAAAAABkk1GezjLqENg-JNlMI-PLIBHuy3NJN3NhMZlr6yMBtV8VXQjyIz7iSqMTgFQDDfbRxypkFejqZtLgch4FvYu5Iz8ySkiJ_kaXw7AfHaLEjt9ocyg=',📌 El Metro de Madrid: tres estaciones repletas de historia https://t.co/zds2Fkxjif,el metro de madrid tres estaciones repletas de historia,the metro of madrid three stations full of history
b'gAAAAABkk1GeLdalUJoDYKjGQnKn6kT8RZ1NoRr3nhAg6vqH_0j9SGwVNoK787zdICyUj-JKV7a0bxnlPP5F45NqWLamoMTzxvnh3XOSFowyusviJNUdoP8=',@asociacionLara Se lo que es;un compañerito de nuestro gato sordo lo tenía cuando fuimos a buscarle para traerlo a casa.El de la ataxia se lo llevaron adoptado a otra casa con otro gatito así.,se lo que esun compañerito de nuestro gato sordo lo tenía cuando fuimos a buscarle para traerlo a casael de la ataxia se lo llevaron adoptado a otra casa con otro gatito así,I know what a little friend of our deaf cat had when we went looking for him to bring him home from the ataxia they took him adopted to another house with another kitten like that.
b'gAAAAABkk1GeXIOQQuwHUOCsMXk7Lfp4GE6gkSitUgciktIeHKLr1l9nG8uODbTdgZyNmKAhnP9WTFqXRMFPRrRH895VUY7wvPlRdO1dMWcH8FLwQZ4a9Z8=',"Las cenizas 2020, nueva añada disponible tras más de medio año sin disponibilidad\nhttps://t.co/NF6NnweHDP https://t.co/eKGdxeu8b2",las cenizas nueva añada disponible tras más de medio año sin disponibilidad,New added ash available after more than half a year without availability
b'gAAAAABkk1GeiuwKXzugtJT1F23dMQkQs7xcQa_Xj4K2u-JX_7Ia7N1EfP3tBHepuY_hRqpxcn8lOGhBGREOfra2XcwFAtqKQgdwJ6D2hUIbu-5WcllLX9U=',Difusión 🚨 https://t.co/ur4onOmOjp,difusión,dissemination
b'gAAAAABkk1Ge90iKJ09a3LuXjc97YQ8oSXNvujcRwFN8pkxfqGSmFXg5vTmF4oI4F96mwrooWq7WKy7sFHKhzgvNZgXu1uPqtgWzcVKJ9gvhFPPPS8DsGGQ=',"🧲 Conoce a Robert Wadlow, el hombre más alto de todos los tiempos https://t.co/e575OxKto4",conoce a robert wadlow el hombre más alto de todos los tiempos,meets Robert wadlow the tallest man of all time
b'gAAAAABkk1GerbBl7S5-wPx9r4vZxc9RJVyOM_gw07Ate7AIl7i0N4Q8Q1X6XBv6t-2LyC0leCyRJyp7NCNWaApyttxQJsHhEKkgN_DyoGmGd4SKlaQvG2Q=',"@MsInefable la verdad a mi se me hace súper romántico y divertido, a mi no me importaría. pero si a mi pareja no le gusta no lo haría, obviamente.",la verdad a mi se me hace súper romántico y divertido a mi no me importaría pero si a mi pareja no le gusta no lo haría obviamente,"I don't really get super romantic and funny, but if my partner doesn't like it, I wouldn't obviously."
b'gAAAAABkk1Ge07XnJQ0ufWW7YzzWtKpFnTu3XeMAsuZoqxfAXaVtF2aYzczE-4DHQXl79FM-g7kfzdGoorNIwQYoAmyEZp5__gnpYg6E1GByZ3nqh4sACno=',"@Tauronet2 @MPadremanyFont Se le podría hacer un gran homenaje a su altura pero traerlo de nuevo cuando se está construyendo un proyecto de futuro? A mi no me cuadra con el relato de ""nuevo proyecto""",se le podría hacer un gran homenaje a su altura pero traerlo de nuevo cuando se está construyendo un proyecto de futuro a mi no me cuadra con el relato de nuevo proyecto,you could pay a great tribute to your height but bring it back when you're building a future project to me doesn't fit me with the story of a new project
b'gAAAAABkk1GedlhQQHeLREI0lUmcQ-s78BMgHTUpdWuAhEOi5w1K6hYUgrBZf1nw1j6y7Z4JD-QWsvgQWeXyHHpBpSh-wbUtg4wF7lAssqfHH3CuPGFumNI=',🟢 El pene de los hombres ha crecido un 29% en 30 años https://t.co/KpmPBmOhHV,el pene de los hombres ha crecido un en años,Men's penis has grown one in years
b'gAAAAABkk1GexyIrQmvujgUxAy9OBs7xRsQV14x47w3wtFPfPjsjqyqHd9GwJiBl5wa5chDsDFjQeHgx_MR8kv2cqA-S6f1JjcqYXdwF5ZgQPVIpDjD3c5Y=',🪂 Los mejores momentos para consumir cafeína https://t.co/sIyrtfxYel,los mejores momentos para consumir cafeína,the best moments to consume caffeine
b'gAAAAABkk1GeRp2feMt3ldRWAePPzKAgkOevu0nDC4ab2RuY02-qTHpx5mg6BUYd8apZcwNGK3MXGeMaS7N7XVDc3A7MUaTomXRSSbYKZj5GnduynVOQFRo=',"@Chiowomix Este es m mundo personal, pero si puedes avisa porfi",este es m mundo personal pero si puedes avisa porfi,this is my personal world but if you can warn porfi
b'gAAAAABkk1GeXdhLZN-Y69_8POvVkGSKjfGmz8wr_Qi5DvF2dcDCoG4SrcAE6KNb-QZXa93S1Id3WMKZ47dM6pfrZBfYmx7amLc61MpcOEYC4rXdkl-iFH0=',irene montero viendo #LoDeYolanda \n\n https://t.co/ihWsi8i8ku,irene montero viendo lodeyolanda,I'll go Montero watching Lodeyolanda
b'gAAAAABkk1GeTcD4AU_atb9Fg9dxN0eCUZxprms-IlfAiVafMDVgpaeVuAdmBmJZHgG89cjqq_0qF9BUKEQyRSJ1LjYyUZ61b3PzBjJL9WGzxqBdQV93be0=',@incoemprendedor Qué buena herramienta es para sacar ideas.,qué buena herramienta es para sacar ideas,what a good tool it is to get ideas out
b'gAAAAABkk1GeyVM6RUK0lE_Ftv5yecdm9KUKH-MIR3AC6JVkY98RLycorwhqYeDpSoXlvrgEwFm1VSjLKO0VC8Np2yaNC8rDVTdbs2aI19dqCqW8KH30ySc=',💎 5 sencillas formas de comprobar que la Tierra es redonda https://t.co/kHPfUQ11H2,sencillas formas de comprobar que la tierra es redonda,simple ways to check that the earth is round
b'gAAAAABkk1Ge-JQ4I7bssq5t5GtHJsKmzCNppbt1xA--wcgma3-16yzbVvlYIlNMcbd1KtIj3HH3sndamwD8NOMni8qVI5mM_qUkDOzPWqIXkjDYkW9eiqA=',@mariaceaaa JAJAJAJJAJAJAJA,jajajajjajajaja,hahahahahahahahahahahahahahahahahahahahahahahahahahahahahahahahahahahahahahahahahahahahahahahahahahahahahahahahahahahahahahahahahahahahahahahahahahahahahahahahahahahahahahahahahahahahahahahahahahahahahahahahahahahahahahahahahahahahahahahahahahahahahahahahahahahahahahahahahahahahahahahahahahahahahahahahahahahahahahahahahahahahahahahahahahahahahahahahahahahahahahahahahahahahahahahahahahahahahahahahahahahahahahahahahahahahahahahahahahahahahahahahahahahahahahahahahahahahahahahahahahahahahahahahahahahahahahahahahahahahahahahahahahahahahahahahahahahahahahahahahahahahahahahahahahahahahahahahahahahahahahahahahahahahahahahahahahahahahahahahahahahahahahahahahahahahahahahahahahahahahahahahahahahahahahahahahahahahahahahahahahahahahahahahahahahahahahahahahahahahahahahahahahahahahahahahahahahahahahahahahahahahahahahahahahahahahahahahahahahahahahahahahahahahahahahahahahahahahahahahahahahahahahahahahahahahahahahahahahahahahahahahahahahahahahahahahahahahahahahahahahahahahahahahahahahahahahahahahahahahahahahahahahahahahaha
b'gAAAAABkk1GeAYKJEyQmc24IkuZE2I4C7oAGj5fMS5mNLpi42Ok6FmkgnLljbQFdNRwIXr9hXE9OqH-CkRoD2IqQuwuH0ojpEuNFHbcHRyxCmFv-Ns7icgE=',🆙 Pocahontas: la historia real que Disney no contó https://t.co/93FUXERmbQ,pocahontas la historia real que disney no contó,The real story that disney didn't tell
b'gAAAAABkk1GeS9mVzOnyAyHZCsz5Hbs-DWzapGiapydk4bSZpQsKeCpVoz8We1G06d-lmKyKdr3chU_UcWrPv4jkVo84DxUa0KqsqcwVnAqt2qnPStciGVU=',@negocios_tv Hay personas que no entienden según que terminología o conceptos y comprometido con la #EducaciónFinanciera publiqué un artículo donde se explica que es un #CEO y que funciones tiene en la empresa\nhttps://t.co/L28SyQEOb9,hay personas que no entienden según que terminología o conceptos y comprometido con la educaciónfinanciera publiqué un artículo donde se explica que es un ceo y que funciones tiene en la empresa,There are people who do not understand according to which terminology or concepts and committed to financial education I published an article explaining that it is a ceo and what functions it has in the company
b'gAAAAABkk1GexP0_HrgC6zbP-pg8B4OkVjucyKwfaF9eBqTWg3Ftyh2J3DpIvw5XcKw6RWeDGyMxipZSurl6sGYiu-ZD5URjjwUwYCJqeSJnG86IitHeViM=',"@EvaAgulloPerez1 @andodespista No Eva no, no son ""mujeres generosas"" sin ""mujeres necesitadas"" y que lo pasan fatal con el tratamiento para ""donar"" óvulos.\n\nTú consuélate como quieras pero no nos trates a los demás de tontos 👇🏻\nhttps://t.co/G225062ttS",no eva no no son mujeres generosas sin mujeres necesitadas y que lo pasan fatal con el tratamiento para donar óvulostú consuélate como quieras pero no nos trates a los demás de tontos,no eva are not generous women without women in need and who have a terrible time with the treatment to donate eggs. You should be as good as you want but don't treat others as fools.
b'gAAAAABkk1GetxoIOY4eBw0Q9D5Bbk2T0zWmc-mPEfBrB3GSdeZdbtG7_QTeE_jVnd6vI4Vi3-M_hMtK-r3-dYtHUL1l0XmJypTT0--B8S-Ae6cRzSghXCs=',🧶 Siete de los más grandes economistas de la historia https://t.co/HkyyxYGX1O,siete de los más grandes economistas de la historia,seven of the greatest economists in history
b'gAAAAABkk1Gem45bBDx_zW1RFBTxxCtwled9dgRJ3Egbnb6hxyBC5aicr6TSEYiWAkCWRiRsY6OzGwzzpXpyg_IMmJpG8lva3GdZ27dWQclGOLgjhBMSz18=',Para los metaleros out there… cual es la bandera de los menores? https://t.co/tLKjxngWRw,para los metaleros out there… cual es la bandera de los menores,for metalmakers outside there... which is the flag of minors
b'gAAAAABkk1GeTminoEuMpTZxb-rzb-26ec-A4dyruqETrb2wjvVLUAG9EoVTM18PxbDw_RvSLS5nRfplz48F9pbLlEtbWDd0WhLYJFgOB2SX885zrkB4NuQ=',@SaikoElArtista Esta cuenta es como ver un robot aspirador atrapado en una esquina.,esta cuenta es como ver un robot aspirador atrapado en una esquina,this account is like seeing a vacuum robot trapped in a corner
b'gAAAAABkk1GehdL_HHcNFZvw2oKWdfi8-VX8eDjTa0hH4o_F1t3xzQG7BvsxjA_J6nnQOnQ-D4c5bqfnqRE9SP8WBiiLHZNKVhCcnONEHwNJbabQAjDMOT0=',⚛️ Psicología del imbécil https://t.co/n62UiDCyDt,psicología del imbécil,psychology of the imbecile
b'gAAAAABkk1GeBlzzVsKMIHPnoJSQlGuc9-OIstyJQODiFRWRD-dcjQuge6p6e16GWSNzeKRidWQVRs3ZaTYUFzJQHbWTSR13-8VWrsRz-qW7H_D5BEKIep8=',"El nazismo provocó la incesante competencia entre los hermanos Dassler, fundadores de Adidas y Puma https://t.co/Xcy61MIHZd",el nazismo provocó la incesante competencia entre los hermanos dassler fundadores de adidas y puma,the Nazism provoked the incessant competition between the brothers dassler founders of adidas and puma
b'gAAAAABkk1Ge0Mkf02mVtfznRdQfqymmF1a2Ns8U4vODcfV6r7tjQvSzSjKGT4wnOUrs8EdVPcOiiimuE2LnErIlBkuypBns8hLkACYtI6zwVzHwLnVobGE=',➡️ El pene de los hombres ha crecido un 29% en 30 años https://t.co/KpmPBmOhHV,el pene de los hombres ha crecido un en años,Men's penis has grown one in years
b'gAAAAABkk1Ge_PhSU-YVfXchWHcHmsDvc-LCNa5i-MF51dKPwrAdNnlF6vsL_TJHWWFves8fnIdPSa3Q-aaIS6SLlNB3ET1m7-mCURHx7Qa-kUEqcVAy5Ug=',Que la tenga que estrenar HBO Max en españa estando ya Peacock en Skyshowtime es de vergüenza https://t.co/npiSWX6Ih9,que la tenga que estrenar hbo max en españa estando ya peacock en skyshowtime es de vergüenza,that I have to premiere hbo max in Spain when already peacock in skyshowtime is of shame
b'gAAAAABkk1GePiHnMlDB35YPVHZhCFdfOm1olB9z3Vw6TpKW7jqolK7sYDm13KpguNd4_4d5-zAheYbr5dlLEfHrYQMjhDchD2Jbd4PC9RxcOJKVLeRLUWY=',"Tanto crudo como cocido, aprende a preparar adobos. https://t.co/OSN0JD5N1W https://t.co/lM5HZP6xIb",tanto crudo como cocido aprende a preparar adobos,both raw and cooked learn how to prepare marinades
b'gAAAAABkk1GeSl99W_DTfBh9PDOltq2D5D_t1kx3bFe8RJdFxJlGo8DNKvGQqvvYg-CwVAQg-qjsTnhZy9ra1umhFBBCl1wsR9A4km2GgQeckGd0h04XplM=',"@AlbariCocker @marcflorensa Pues mira ni con rollo homofobia, transfobia ni ninguna otra inventadofobia victimista y caprichosa vais a acallar a las mujeres 💪🏻",pues mira ni con rollo homofobia transfobia ni ninguna otra inventadofobia victimista y caprichosa vais a acallar a las mujeres,"See, neither with homophobia transphobia nor any other invented victimist and capricious phobia are you going to silence women."
b'gAAAAABkk1Ge3WPxfYj2GqkEixjuGObMm3hVkNBmy4q19JMDmYiW1Z7lsL2eh-T_HBKI75T6Xo5QK9WIkndf4AG_t0V5jy7puryRgNqX3tO7avGQ5JljOrY=',"q las chicas a las q no les gustan las mujeres se besen con otras mujeres para atraer la atención de los hombres es asqueroso, y fruto de esto, cuando las lesbianas besamos a nuestra pareja en discotecas muchos hombres se piensan que estamos haciéndolo x ellos. + https://t.co/LfoKd0OdK9",q las chicas a las q no les gustan las mujeres se besen con otras mujeres para atraer la atención de los hombres es asqueroso y fruto de esto cuando las lesbianas besamos a nuestra pareja en discotecas muchos hombres se piensan que estamos haciéndolo x ellos,q girls who don't like women kiss other women to attract men's attention is disgusting and fruit of this when lesbians kiss our partner in discos many men think we're doing x them
b'gAAAAABkk1GeOggbFkb-h3thWmvB_IBh0SOKtU_tCdu5COQkN8l1-hDrvzGg8jeP_BR17QJ2ctSbZ7pqOz6iDDupR79-gKAT6N5m8B7JsLNnXst8k7L_BUo=',🛡️ ¿Hitler era gay? Documentos de inteligencia señalan que tenía 'tendencias homosexuales' https://t.co/LkFyWDhA9d,¿hitler era gay documentos de inteligencia señalan que tenía tendencias homosexuales,Hitler was gay intelligence documents indicate he had homosexual tendencies.
