id,text,clean_text,eng
b'gAAAAABkk1GiW-mi-hM8Cc1hNgWyLL6ZvMsfXM_WVotcXFooDaUyVTfSHdTugXy6tUuIuWymAgpo6lRknJ9hRP8O41VtxalpWAljiZIZaix6wE1beDvwQvQ=',@kksposting @GiovanniFenix94 @PulpiFan23 @itdeterror @GabrielSanMx Jajajaja estas bien bandeado hanlando de cosassque ya no tienen nada que ver ... pasame de esa mota germanooooi,jajajaja estas bien bandeado hanlando de cosassque ya no tienen nada que ver pasame de esa mota germanooooi,"Ha ha ha, you're well-swaming about things that have nothing to do with me past that German mota ooooi."
b'gAAAAABkk1GiwXR9n6iRBvqXuQ_F_xL2Sheptyb0OYTJNl91lNebLcu1Ao8h_6uLafd5DQ2oqKrGsKyGtBxCPkFkVtE3o_ZLvz7e9agTSnbLGjARBUGKmN4=',Nuestra 🐐ya apareció 🤩 https://t.co/PjtEcjnljh,nuestra ya apareció,Ours has already appeared.
b'gAAAAABkk1Gir_v84z0Hw0FbuKUkBvsEEQwXoCFSTQjbdu6ZBYazTDxZ7mchcywqIG1ZLFO0R8J0E3L6UTGdCEAkeGIDXxCRHReQXi4b6CRNav4wxqn2-Cc=',Pues...dos de mis pelis favs ever y una que no he visto. https://t.co/79PbcLokQq,puesdos de mis pelis favs ever y una que no he visto,of my favs ever movies and one that I have not seen
b'gAAAAABkk1Giv70VJVb550ITi0Fc91IajCCBonNSjpEFPFTbBcheLk70R_ub6NGGSLuEFZLu6YD7ON_IYvepfVZ2whrvX07ZY8e4T0cUYVyiRoRv4YjXtSk=',@manuelrico @DROPEIO @fiscal_es Gracias Manuel. Mi apoyo y RT.,gracias manuel mi apoyo y rt,Thanks manuel my support and rt
b'gAAAAABkk1GjFWXH_10WFqARNbio8BXwaFfWpSYWFdHKjfgYcSojHksS6VnaDPU0u_OJsOgf9sTr13py9-aNgn-9ZfEPr3Vb8CeF57WWn8FQtaL3DXK-hyw=',@suriCATreus Me he quedado cabizmunda y meditabaja :)),me he quedado cabizmunda y meditabaja,I've got a little bit of a mind and a little bit of thought.
b'gAAAAABkk1Gjc8WeMf32YA0GO5PpwiEEeBIRcDJsDDAe0zSX5OHEsY-AAXZVNuCU_3v848NMbrO0B-ciPxWyTmS2F-gFbVXKWTqmCb7AxkaNYGJejdpwjMI=',"@BelmonteDogMeat ""Puppie"" queda más tierno...🤤🤤🤤",puppie queda más tierno,Puppie gets sweeter.
b'gAAAAABkk1GjdDWX_Ay2zr9SXRr-Q3PVwbrfARwMZ-qY4DO4XhdZrO5jZt7kaFeXAIvdxEXK36UHAWzQjYjsAAGBQGUMLEJk9o1x3t8fA83tzdTEFbmSc7I=',☄️ El infinito sigue siendo más una idea que algo que existe en la realidad física https://t.co/JDBi4OBXqc,el infinito sigue siendo más una idea que algo que existe en la realidad física,infinity is still more of an idea than something that exists in physical reality.
b'gAAAAABkk1GjHudnauBHYIhU97dVDDQeyoGL3bAGJ8c7Mzj1IfFRkyHfdjqllGJJSi99EyQV_Nl7bDiPn1Y9EREbDvTDQTJad7ohVd2Qb0oDItVypSU4wws=',🚧 NOTICIA | OpenAI lanza ChatGPT Plus a 20 dólares por mes: ¿de qué se trata? https://t.co/iWAvBQq13j,noticia openai lanza chatgpt plus a dólares por mes ¿de qué se trata,news openai launches chatgpt plus a dollar per month what is it about
b'gAAAAABkk1Gj_ov8U3MkOkrlGsxIVHDROcJ3tpEvIBx4dCI2D-2UrhnDC-CED0o_1bPQl0VXrw5pcLzFvXGUDEIAb_xQUgbMjldPG9Z_ewVDZHgXXMjKrxg=',Esto es historia de Twitter. https://t.co/6DGhcoGMsa,esto es historia de twitter,This is twitter history.
b'gAAAAABkk1Gjci7pDF9YWfayOB3nrWSml_Iu26vHbkihESKOBr2GQ1gA0uOto_GLBDxP7MeMKQUGFm4GEjw6w-6PPFpr9JlgFjifTfwIANKmOCjOt07nIN8=',⚛️ Dormir la siesta: ¿beneficioso o perjudicial? Esto dicen los expertos https://t.co/TU6DojMdik,dormir la siesta ¿beneficioso o perjudicial esto dicen los expertos,Sleeping the nap is beneficial or harmful as experts say
b'gAAAAABkk1GjTBcIkjQqgYv3OKLwJm2GrxwYCDKKkv7V4s-Ecck3U8w7yHKv1_F1ZyJF5X3U5uiHQma_KzrmDmKCe-rP9s8xo0GKreyFxR2c8_9RQSqcH8k=',⚛️ OpenAI lanza ChatGPT Plus a 20 dólares por mes: ¿de qué se trata? https://t.co/BfrFqwv0A1,openai lanza chatgpt plus a dólares por mes ¿de qué se trata,openai launches chatgpt plus a dollar per month what is it about?
b'gAAAAABkk1GjW4EcdQlJUWymIWFgYRp956ciMlrL9wKlV0FnTtKsoItHvr3AnzB43-tupRRy0pi83f5bdf60BYB6OBHi-wLApLCgScLwCAvhjClIZ0oYGIc=',“¿Quién quiere que España arda en estos momentos? Esta es la pregunta con la que se cierra el primer trimestre del 2023. En Bruselas no quieren que eso ocurra.”\n\n@EnricJuliana sabe hacer buenas preguntas. Y poner contexto para que pienses. \n\nhttps://t.co/GvpRCbTCFp,“¿quién quiere que españa arda en estos momentos esta es la pregunta con la que se cierra el primer trimestre del en bruselas no quieren que eso ocurra” sabe hacer buenas preguntas y poner contexto para que pienses,“who wants Spain to burn right now this is the question that closes the first quarter of Brussels do not want that to happen” knows how to ask good questions and put context for you to think about
b'gAAAAABkk1GjgjYx3so6hu5Ytxctsm3MyHOid4WxMkypxrwa9MNVs-Vgfucg2vu39AZALzk9K3DYpY6KDcrQr-kUv7csgazMHuRM8y2SQbVJf0IAZkkIleU=',👾 Teclear y usar el mouse: Los nuevos indicadores de estrés laboral https://t.co/ARv1KGOhoV,teclear y usar el mouse los nuevos indicadores de estrés laboral,type and use the mouse new occupational stress indicators
b'gAAAAABkk1GjRfSTSxVgBxj7CnM8l1UMVD2wiQmx1CMCA584sAFFXZ3GrSUddDTOk6cz2oRkIKbjh6oXUBe2BthHNVHwQs1s-hVd_jflT4U34FhkWr8eHBo=',📳 Los dientes de Hitler confirman que definitivamente murió en 1945 https://t.co/1PSEalPvsn,los dientes de hitler confirman que definitivamente murió en,Hitler's teeth confirm that he definitely died in
b'gAAAAABkk1GjfRiXoM1_8JcB7cQlVr1_as8-mG5TePAXB-_0Jx0TB9vqy44uGeiykgAekzeOIWx1l_zYwDVXxudK61sOQ6mwcOX3Y2MQzsbRgb-Jx9J8HsI=',🔁 ESTUDIO | La sorprendente verdad detrás de Tirzepatida: ¿se descubrió accidentalmente una nueva hormona de pérdida de peso? https://t.co/z3jX36PSGc,estudio la sorprendente verdad detrás de tirzepatida ¿se descubrió accidentalmente una nueva hormona de pérdida de peso,study the amazing truth behind tirzepatide was accidentally discovered a new weight loss hormone
b'gAAAAABkk1GjXD8YTy-hITDE14wC6KLvvehh-X7LSJhJgOh6y-l8eEq1U0G8lqM31zX_5dbdmFNKwk1Vjzfy51gUM5Me_L6z1GJ8yySvl35hvSasqb7unGA=',"@pilareyre Por cierto, nada que ver con las técnicas de reproducción asistida, que son tratamientos médicos.",por cierto nada que ver con las técnicas de reproducción asistida que son tratamientos médicos,certainly nothing to do with assisted reproduction techniques that are medical treatments
b'gAAAAABkk1GjX7WN2W__1JdRjyJ8FJ2oEJXZqK8EaQDK17emlItPbyKTsHFTK-geOWrohiv17gLoP5-QNRcRjxAF12WWqIACr2sfGGePidQG1Tqatv_i5Hk=',¿A qué se debe el altísimo precio de los relojes Rolex? https://t.co/6PmWfMdgy3,¿a qué se debe el altísimo precio de los relojes rolex,Why is the very high price of rollex watches
b'gAAAAABkk1Gj8cQDqwiaFZgClHbcZmEGluXzytwvjzilJ-ryLe5oKNL9E7MbOOGD6EeXVGEhK5kuDzXPqL_6pYP1fMuTKsEQ5JUPVvKn0EJhdx2ZamnPAKs=',"Quieres que tu dinero no pierda poder adquisitivo??\nEl sistema SHOOT te ayudará a que tu capital suba en lugar de menguar por la inflación, Impuestos, etc.\nSUSCRIBETE!!\nAbierta suscripción sistema #SHOOT  https://t.co/bMUJ11b9uJ",quieres que tu dinero no pierda poder adquisitivoel sistema shoot te ayudará a que tu capital suba en lugar de menguar por la inflación impuestos etcsuscribeteabierta suscripción sistema shoot,You want your money not to lose purchasing power the shoot system will help your capital rise instead of waning for inflation taxes etc subscribeopen subscription system shoot
b'gAAAAABkk1GjQxN3BZZPE89qiEc5R8J3ZbMOnsXT2D4PaJYFtVhWrlXSZBsdjmfYkpX5GCoRLQzNXoeExXbf3m9-LP5lD9YmUZqaSBj3gfbE0LBMKCMPSGg=',@vsequeiracopy Algún día habrá que mezclar ese copazo con un buen email. Seguro que salen cositas chulas.,algún día habrá que mezclar ese copazo con un buen email seguro que salen cositas chulas,Someday we'll have to mix that cup with a good email. I'm sure there'll be nice things coming out.
b'gAAAAABkk1GjifpDcY-CyCcC7lvULbNdp0qo6_I8Q7Vw90S_v6uhiSioiZC1irsIf2zR7GPvDokGqibZmovLer28wBfB9an6zaXrnkCY_AyaDyeTku23Zg0=',yo es que directamente no saldría con pavxs que consuman porno (sin cuestionarse porque está mal la industria) 💀💀 https://t.co/WCoup3Npj5,yo es que directamente no saldría con pavxs que consuman porno sin cuestionarse porque está mal la industria,I'm just not going to go straight out with pavxs that consume porn without questioning why the industry is wrong.
b'gAAAAABkk1Gj6mDIDj68QcMn3MvSyKTM9H7iQdroGkWrNAogkSK2pmKXegYcscEHvo1TcLifM32EJMLp6OoY_7RzxYorBIWUsktwVUv9vEuJRFbH27miWkM=',"@Camionero_Esp Asegúrate de beber agua, no te deshidrates de llorar. https://t.co/mhME5xEeCY",asegúrate de beber agua no te deshidrates de llorar,Make sure you drink water. Don't get rid of crying.
b'gAAAAABkk1GjpkI8INWo49iWVI02ShZfeSy5GlEJ40vb4j5YspR6BJllHl0Wyd0qt09zNObtx_Fx46R1CtQoPTpHnWJuzcIsmCcni_9kMZSkmkyQVV0ACnA=',@Jonvlogs Q lindos son los dos😍😍😍 verlos felices respetandose proyectandose una vida juntos,q lindos son los dos verlos felices respetandose proyectandose una vida juntos,how nice are the two to see them happy respecting themselves projecting a life together
b'gAAAAABkk1GjK5W1IEMCJQhvBbc9NMxYOe5-05pdD_es3fn8obroBwokFebg3-KfmgAW0jKHlklfZML9K29Mu4NLB5fvww3L5gWVYL0W_8wZRyT5Roo6aKU=',Kessié hace cualquier cosa…\n\nAutomáticamente yo: https://t.co/yWM9OJSVI8,kessié hace cualquier cosa…automáticamente yo,kessié does anything... automatically me
b'gAAAAABkk1Gj9U8Eq85ptcWou7rVX0mekB4dCQACi-UQ0_3oRYMTrs-AEu7eKMzHmGFWU1nbVZB-uUTiR0BHGAsm1jG_Ab3uOTFco9POlOydzcGAsL2mnHM=',TE AMO RODRI GRACIAS POR TANTO,te amo rodri gracias por tanto,♪ I love you ♪ ♪ I love you ♪ ♪ I love you ♪ ♪ I love you ♪ ♪ I love you ♪ ♪ I love you ♪
b'gAAAAABkk1GjDiE2Dm3VKVVEM9Px5LE0Zu9N0uzBLmqf2ZeY7a983OU7FZSnxf4PD9-W5I1S-GlzswTbdy0fBfrbALiEuLKZpA8I_wo2Y3Vuy0_CNruA7NI=',🎟️ Esta es la primera ciudad que prohíbe caminar mientras se usa el móvil https://t.co/q7NYTu8AJT,esta es la primera ciudad que prohíbe caminar mientras se usa el móvil,This is the first city that forbids walking while using a mobile phone.
b'gAAAAABkk1GjnOSGH4tn8GielzhL65mS8ml8caLD3P56CgHadcKN6qbhwB6bS7dNn5f2JvMgqVAMMkxK3uatkNjmLXWrRHTSe6G9SshrXhae8ik3i3jelZk=',Cómo no quererla 🥺😪❤️ https://t.co/tuJyzlFd8J,cómo no quererla,how not to love her
b'gAAAAABkk1Gj9h8-_lO1zI1mSA40QgmKd3cGfFopgHy762wAYgQYhOIrJu_eiwvFekDvx6CTZmgC4BBmQwLfLgqosEe2KpdnhjQeHY787whf1lJQoU1bMLU=',@fuetambjagger obvio es una indirecta porque es la puta canción más conocida del puto mundo,obvio es una indirecta porque es la puta canción más conocida del puto mundo,It's obviously a hint because it's the best-known fucking song in the fucking world.
b'gAAAAABkk1Gj8kuaXvhagshtnuh8ZOyZXY5wIPBM2320VUBulmLmAcJ0qUyAQOdO1-ti9pA7FDDacN6sH8_rZ4wQxGODkh1Hn3lrsk5-z5wEjQoHQOlFPOY=',Raul Rosas es una maldita bestia y solo tiene 18 años 👏🏽 #UFC287,raul rosas es una maldita bestia y solo tiene años ufc,raul roses is a damn beast and only has years ufc
b'gAAAAABkk1Gjt91MnOpbhwv5dpA0yoD-_q5tdY86qJSF-g7x5SwacKgpH02E1g9qKidAF0pI9zrLgMoW5O10fKzIoi1XjeZ7g1evaG7JXBIyf7lVnIZNZ_U=',"""Todos los grandes acontecimientos tienen lugar en nuestra mente"" | O. Wilde",todos los grandes acontecimientos tienen lugar en nuestra mente o wilde,all great events take place in our mind or wilde
b'gAAAAABkk1Gj_cnXOMg8PiJj3WhbxmGS61n1Z_BZctXLDhC9h22YNuylnBxgwnEGN0JPpDoQ4n4mibrJn7j0A12eMYVmlyGAX055nnps6EC_sI67DKnay0Q=',@PapaBuyer Pues explica @PapaBuyer cómo el campeón de Europa va octavo en Liga en el 2023,pues explica cómo el campeón de europa va octavo en liga en el,then explains how the European champion goes eighth in the league in the
b'gAAAAABkk1GjKQnKI--RbZjzzE8ePqDQWhA4ajmhHECNyFidU1XkaV0h3VWfVsCFHFEBIcQnmB4euvoEoAuELhtjMZczkJWqGDzqeSCOBxfHJAy9U8rRZuc=',🎲 Felix Hoffmann fabricó un analgésico que era seguro para el uso diario. Pero luego sintetizó algo mucho más potente (y peligroso) https://t.co/clXQammmW9,felix hoffmann fabricó un analgésico que era seguro para el uso diario pero luego sintetizó algo mucho más potente y peligroso,felix Hoffmann manufactured a painkiller that was safe for daily use but then synthesized something much more powerful and dangerous
b'gAAAAABkk1Gjls4eav75AUrkGXUWUm9NH--XLuQFhYBZyWamcavbgPL64r-vnfUhyZQNYW2F9N9pypU3xMZRrVcT4EjdCIlw6KUYjUk6Tc7kHiG6nhBSW6s=',"El delfín hembra tiene un clítoris similar al de la mujer, pero más sensible https://t.co/lEyVbdEWxy",el delfín hembra tiene un clítoris similar al de la mujer pero más sensible,the female dolphin has a clitoris similar to that of the woman but more sensitive
b'gAAAAABkk1Gj2imf6zgpXot1APNJiMiCQW6P2CgUE8DuCzE2reHva-p7o9XWNIGUKO8IMPt4Z6gf-q-ac68dS5y4DzjQvoCnSXKZxj0Ejx-HE8R_SsEGsPQ=',@cadogan333 @Borges_es Sabéis cuántos productos andaluces que consumen en Catalunya y cuántas fábricas andaluzas fabrican matèria prima para productos catalanes? Sois tan cortos...como se empiece el boicot...,sabéis cuántos productos andaluces que consumen en catalunya y cuántas fábricas andaluzas fabrican matèria prima para productos catalanes sois tan cortoscomo se empiece el boicot,you know how many Andalusian products they consume in Catalonia and how many Andalusian factories produce premium matèria for Catalan products you are as short as the boycott begins.
b'gAAAAABkk1GjPfdUmifkYBvij2tUsjayUDd-P6tuHrbIxCsL7XhmwAdwhmeo7Jx1RRKrbIKlcJA57IrjcVUlSyeGvyBuHVHfgG8ieCLa_fEAVGWIjlj3Mfc=',📥 Edwin Hubble y el descubrimiento de la expansión cósmica https://t.co/9a2eVRENJz,edwin hubble y el descubrimiento de la expansión cósmica,edwin Hubble and the discovery of cosmic expansion
b'gAAAAABkk1GjfcNQltZSzJDQf9-06BDclfNHvvcaLUiZxKRzY6jsrKjg9_UKnXNj6pVf7a7pihywMGTz3P4XAavXanpQzb4EV9Twt_RkrFKeC-id5BAu-eE=',"📳 Esta raza de perro tiene conductos respiratorios más planos o más pequeños, lo que puede causar ciertas enfermedades https://t.co/1bqqOyBwIY",esta raza de perro tiene conductos respiratorios más planos o más pequeños lo que puede causar ciertas enfermedades,This breed of dog has more flat or smaller respiratory ducts which can cause certain diseases.
b'gAAAAABkk1GjWeP8iRrofxuerjLvkPLNo_wCyXGXfI-Zbg7HIeXnblxyY1RK0gpzNmzngdpNvjXRQjo0WGL9Gx04L45pvukeSSw81xsOtg5vibcPFsIoC9U=',@anesthhesie @MalloryMind Yo creo que si se hacen caca,yo creo que si se hacen caca,I think if they poop
b'gAAAAABkk1GjgasOQYfYlX4jHa_CPmPBA-wg4wZ_cjn7am8yIG7IAP3EqCF8TU-59wpF4d6aacBjsXebR8hXJ8Goae5epFv8oHiA9Xd0zp3eefO-PqHyQ9M=',@bonmapi bufones,bufones,buffoons
b'gAAAAABkk1GkKsMp155IscBMLk9VRj0mie_wW72qpJbtrdgETakd-ZaXLvAlQWXovNeqKVB2l4-nktOIh6l1gla6zzdjAady6bufV2TeOLplXK3dOsIYxiI=',"Una historia incipiente.... GRACIAS equipo\n@incipy, clientes y socios. Hoy iniciamos emocionante etapa con nuevos compañeros de viaje @atSistemas\ny una mayor robustez para seguir siendo aún más referentes en esta nueva era tan #digital y #tecnológica. \nhttps://t.co/QUGOGLGmId https://t.co/4fr7qCk1GQ",una historia incipiente gracias equipo clientes y socios hoy iniciamos emocionante etapa con nuevos compañeros de viaje y una mayor robustez para seguir siendo aún más referentes en esta nueva era tan digital y tecnológica,an incipient history thanks to team clients and partners today we start exciting stage with new travel companions and a greater robustness to continue being even more referents in this new era so digital and technological
b'gAAAAABkk1GkefMhSYzeDQbKdPWtYe5S3dy6zmtTr0lfv-GXcARdm5Y_a3XT49od5XdDCIWYncpNMIUFIf9HZ7eFUU0XzvR4NUZKcf5XChbz8VbYl43hfOc=',"@MPadremanyFont De verdad consigues disfrutar del fútbol? No entiendo a quienes están constantemente pendientes de polémicas, del rival, de arbitros...",de verdad consigues disfrutar del fútbol no entiendo a quienes están constantemente pendientes de polémicas del rival de arbitros,You really get to enjoy football. I don't understand those who are constantly awaiting polemics from the rival referees.
b'gAAAAABkk1GkaMY5htF1FePK83Yg9EftvoNHlBURMF07TObEClI_0NBgLZOGIH51O7RjW-6glNw2ILaFdeQM1h7h5AmFgY8Ej8tef68VFLLrRzWD_wsdm0s=',🔆 El hombre está condenado a ser libre (Jean-Paul Sartre),el hombre está condenado a ser libre jeanpaul sartre,Man is doomed to be free jeanpaul sartre
b'gAAAAABkk1GkCgD44uPU7bdrIm2SQunJGAY4EM1gwfkzwuDwlb9mkuAtDsfFFHMC_z95knr2fiCKBXPjPDCIOmqOBsyjDHLbcT5Dh4DxPWs7HDnE15Rg510=',@madrefoka_ Realmente sí pero quería que pasara Osasuna,realmente sí pero quería que pasara osasuna,"I really did, but I wanted it to happen."
b'gAAAAABkk1Gka9nq0e9jvr5OH_7PFAA-_iC3dkDzTw0Bjt6ZU30j5iUXsOB7I430iFhhFieuUeU1GeKyL8gBTHeOXNZC4xiyHv0_dEGFvmGktGeuTkeNzEI=',🎈 Descubriendo al Jesús histórico despojado de su faceta divina https://t.co/IzNeahqZm3,descubriendo al jesús histórico despojado de su faceta divina,discovering the historical Jesus stripped of his divine facet
b'gAAAAABkk1Gk9BHziAHADN356Tp0fMEUihRrtSLR83c8z1fckVc3vnHtp2vMH17QIji1jqIX3i-IAprKXD7yFyaaGN2-OKsKVDvgPbGPyZC25XmEerncrmQ=',"@BuilLoren No estoy seguro pero me parece qué #ElReyLeón , #Aladdín , #FIFA o #StreetFighter …",no estoy seguro pero me parece qué elreyleón aladdín fifa o streetfighter …,I'm not sure but it seems to me that Elreyleon aladdin fifa or streetfighter...
b'gAAAAABkk1GkvT2ECCC1zC2K1Zj_xghrwJGvtaAqBZLWCENABGG__zxoKh1X0cdToKPFNr7rKqCmsAC4m4Ra5wpS16NTrRQu413zDxFM-eGnodzMwKGYjiQ=',🎈 El ajedrez y la demencia https://t.co/HQGK5m5JEk,el ajedrez y la demencia,chess and dementia
b'gAAAAABkk1Gkh_KTRykxROhnAHpj5JIy_jtQw8MQdfMX3PxK2mMkl9NrbwLMryd9jcjLeJ0FaBWYyxUv5s5WsozpmVT3wCTHWK-r5LXmamhXzBGUtnoc5zM=',"@Cerdido_ @pdelapolla96 Pues coño, me estas dando la razón. Que coño me comparas esa plantilla con la de ahora!",pues coño me estas dando la razón que coño me comparas esa plantilla con la de ahora,"Well, you're damn right you're comparing that template to me right now."
b'gAAAAABkk1GkunJQUuKtMGcixQcFmRzPhKfMx5sUXiauZWB0-UvxjIuTUKMQ83BoxcPInAlx9OMSs0VYg__yguGctytRYSKWw9N6OaGwmFzyvgq0Oob8vts=',Cómo que el Romano del FCB se ha ido de twitter 😦 https://t.co/2YasftBrnq,cómo que el romano del fcb se ha ido de twitter,How the Roman of fcb is gone from twitter
b'gAAAAABkk1GklqhfekAXwBhK3zdQI6wDoGm5EOqOOaQpdRaZU_Pi7gdX-kblcFB7wFFn2iFl0SWqn573ZmmIQfchzin2_HFxS_NNuoY9ne3ms2yzyrsNj_c=',🔃 La razón por la que los perros tienen la nariz fría y húmeda https://t.co/hunG9J5DPw,la razón por la que los perros tienen la nariz fría y húmeda,"the reason why dogs have cold, wet nose"
b'gAAAAABkk1GkHa4a8qbSsqvNsY4FVYEPM7cuPbCskkYlbT-Sam69NUSG0E25R6cfcoF1aFGmqlgLnprplmhI_ytdgSnlAFzoe0WDQXlESkjyiUd5GITfU3k=',@ciberneos @phxr__ @INCIBE @RecuerdameBot recuérdame en enero del 2024,recuérdame en enero del,remember me in January of the
b'gAAAAABkk1Gkrgavrp8e17mUDR63vu7fEje-yTsBrcaPUbD3eKZPZRAyuQWwvdoZ_KNsHcrVjyhrYknvdzyrCeEwmPHvp33zAxW_Li24HvSeJnT2q9qL5Gw=',dios como amo Anne with an e,dios como amo anne with an e,god as master anne with an e
b'gAAAAABkk1GkSKEI0omMjNPjGVWK-wZhjp2nnMLTvxQIkGIndWm1CjKpJx11mGiKQLjxjmsLmo6QGDVALkaAMH5YgUKLOT2g-fHGeOs8G3xggmRNZhcr-f0=',"🗣️ Descubre las misteriosas circunstancias que rodearon la muerte de Bruce Lee, el artista marcial más influyente de todos los tiempos https://t.co/YflaAhSkk2",descubre las misteriosas circunstancias que rodearon la muerte de bruce lee el artista marcial más influyente de todos los tiempos,discover the mysterious circumstances surrounding the death of bruce read the most influential martial artist of all time
b'gAAAAABkk1Gk68JmSOE6unY-Ve0N2wHC4kwvTT6F5eJ6foS7r72rqnJLzkUqUOOKXiH_TL05QDYjQAVtNj4UdAanF3mItsqnknIIA_8PR5KwfZ9Txt-xqoY=',Ese wey si manejaba súper… https://t.co/di8KasIMpI,ese wey si manejaba súper…,That wey if he drove super...
b'gAAAAABkk1GkFWUFDOQsWiI2-_yHI3-kSiD3iqFMxb3UEX3vfhOOaDbprSRHO7E0pxLlT7x3MIGLx95ADND0aRmLCfHJt9EaAAQS6FhFwJwzpYgTd7SvRx4=',"@OlavaOlaviene @Taiytotsuki1 Claro, porque Barcelona es toda Catalunya 🤦🏻‍♀️",claro porque barcelona es toda catalunya,Of course because barcelona is all catalunya
b'gAAAAABkk1GkhVXqpeX7buRhmCASrtmmKRaa-mj2K71GnndUA2AZREIPiFErmi-awKSo0zE73qLn9kNV_b_f0HuMOqkpWsQFqIPvrkOVojQIz1rjO5ufLNw=',@SoydeZaragoza Menudo TRUÑO https://t.co/nVylBLAuWJ,menudo truño,often truño
b'gAAAAABkk1GkhQ9b6zdD_dsOfsiBf9lBPCxwv67JUGjAGfOXpFKJSoxlFu3_pKuIg8HYCzcSOoAAm6nvjysYXTDfNSZcGpB8OuxEWJbnCTqVf2xWulEZACc=',🔵 5 Medidas responsables que debes seguir antes de hacerte selfies con animales https://t.co/g6O3Xltypk,medidas responsables que debes seguir antes de hacerte selfies con animales,responsible measures to follow before making selfies with animals
b'gAAAAABkk1GkQaqy75YBvNAy_u0jL0K25bWuUtzDu_ON3zaKp1_KTBSm5nHPVCTLgs3_X7RGd3FFRwKiFIIPhQ87UyvPrCn9XkWC-fg_z7TRw4nJKCEFVhA=',@OlaySkin también usa al tipO este\n\n#BoycottOlay https://t.co/hoYVJxevhf,también usa al tipo esteboycottolay,He also uses this boycottolay guy.
b'gAAAAABkk1GkZC9lc2vjt4sjlaxew_zWW_k3wIDbznaNDdMXH8SGpxe9ojeDchCQzOM7RabrJmqyZzkCj4PNURXN7MaNapMw94Lu9eAp2g7goHJlgQFJSHo=',La mitad de los representantes? #PrePartyES23,la mitad de los representantes prepartyes,half of the pre-party representatives
b'gAAAAABkk1GkIqb6aVHldcYzdQfAHGXCO2orblBCC5tbgSnEiX79hWr8vsG_Y6iIK4lhcoaXHXQQCogssLFQAdKNGS3vXhUrnORdx1Bm3sy3_TD321nwbKc=',@directopaladar Mejor comprarlos en una librería de barrio que en Amazon,mejor comprarlos en una librería de barrio que en amazon,better to buy them in a neighborhood bookstore than in Amazon
b'gAAAAABkk1Gkb74aIMT6hQDHLO-M2kSYzDAEogkZgAz89kKi9525-fYShFNZSeh0t_OFhW-hSYQnhpNpKDwGkfjc6M3iSFYGj5cvSPkN8xBev3H5Jx_zLCY=',▶️ La muerte de tu mascota: ¿Tan dolorosa como la partida de un familiar? https://t.co/zmoI1XMtXJ,la muerte de tu mascota ¿tan dolorosa como la partida de un familiar,the death of your pet as painful as the departure of a relative
b'gAAAAABkk1Gk74VSJlzkHpFdPTaSu3dRNcFCBqlwv5UDA4yqXbbUG4KHh9-iD6POraD1cp6SLW1qhjUlJml0k6-R3Z271QDostXj5Q-Mmd21Auo3RAYmPBs=',"@elchiringuitotv @LaLigaDeRafa Que circo por dios !! No se como ay gente que ver este programa,  parece un grupo de bar del pior nivel discutindo.  Como tv3 nada !! Programa de paletos para reir",que circo por dios no se como ay gente que ver este programa parece un grupo de bar del pior nivel discutindo como tv nada programa de paletos para reir,That circus for god's sake I don't know how many people that watch this show seem like a bar group from the Pior level arguing like TV no show of hicks to laugh at
b'gAAAAABkk1Gk8Ny2xW6KOkIs9OdMa4X7yo8Inc9hILvvKW8HJMSir48P5AZR2Sj-2Z4GodlKww8TbBsoeTAkclcW7VjwPQkl04IaqDdprTtHbJ42FaLShUY=',🔵 RÉCORD GUINNESS | Bobi es oficialmente el perro más viejo del mundo https://t.co/6C0M8tlAd2,récord guinness bobi es oficialmente el perro más viejo del mundo,record guinness bobi is officially the oldest dog in the world
b'gAAAAABkk1Gkayd6XgO63GqhrmZ0JQ3yp3mUaQOeMEsGtEz6UpwncezB563RXk3YuPhYYXoco_zpJ2FL2QLqYnQamJHhmoaOUYdIf6rpLL12w1Llr1qIC3k=',@shirolamperouge Nintendo ahora mismo https://t.co/vzvIhE9HDr,nintendo ahora mismo,I'm trying to tell you right now.
b'gAAAAABkk1GkamCjbViK7lTEXXByhOHRAUrUv2AhyDcakCcmu9bbCmc_uyWkUh5DZKe6IUBh0JRCR6dlWT5MVUuSW7SQYkgYT5lHehY1EjbHns83UMTsmlM=',📣 4 sencillos métodos para madurar rápidamente un aguacate https://t.co/YyTcyfQ57M,sencillos métodos para madurar rápidamente un aguacate,simple methods to quickly mature an avocado
b'gAAAAABkk1GktFVWngi7voJHezGSJ9RA7wOsjYFCqAwAlGhvpBRv5FAqQYRjsncG2d8GxMjTlxGFoIw5bq9-x_CjYfvaB1XECK5qNlOJiTpKpcaTCFPfNxU=',"@JuanfeSanzPerez @rfef exigimos un castigo ejemplar sobre estas cuentas que promueven y justifican la violencia en los estadios, son fanáticos ultras que con estos twitts están incitando la violencia contra jugadores al acusarlos sin pruebas de algo muy grave.",exigimos un castigo ejemplar sobre estas cuentas que promueven y justifican la violencia en los estadios son fanáticos ultras que con estos twitts están incitando la violencia contra jugadores al acusarlos sin pruebas de algo muy grave,We demand exemplary punishment on these accounts that promote and justify the violence in the stadiums are ultra fanatics who with these tweets are inciting violence against players by accusing them without proof of something very serious.
b'gAAAAABkk1Gkzn-bzCnK8N6YGnOoUzxjux417uaqhtFaa7eAOkJoEag7aFr3NVQB3Di69winjjMv7RsiVAEuz9d-ZP70do23YAXL4SoKyQoaTKIjrH_ovOs=',"@SaraiUrkia @UnaiBetono Joder, no lo había visto!!! 👏🏼👏🏼👏🏼👏🏼",joder no lo había visto,I fucking hadn't seen him.
b'gAAAAABkk1GkjpGPTeh77miIdSpFT3EDC9ArP8MQNNDMWvU7sVqdvfkPY4MUInhac1grnOCC8Hv23mNtGPm3fhrx4UXCWKbdBfpS-08dXX5hSxeKzEyLApY=',💠 Felix Hoffmann fabricó un analgésico que era seguro para el uso diario. Pero luego sintetizó algo mucho más potente (y peligroso) https://t.co/L0khqdoaXQ,felix hoffmann fabricó un analgésico que era seguro para el uso diario pero luego sintetizó algo mucho más potente y peligroso,felix Hoffmann manufactured a painkiller that was safe for daily use but then synthesized something much more powerful and dangerous
b'gAAAAABkk1GkwXR1siHnjYVnJX5x2m6cQS3fJhIcfv8ymCsoowAN1u79-nhAoOAYU2XecV2H3H4KL_CwRgK7nh2MQ2em9MgwX50nB32U90wWuL78nzK87zQ=',@PabloEchenique @PODEMOS Me alegro que estés en forma,me alegro que estés en forma,I'm glad you're fit.
b'gAAAAABkk1Gkjr0GYYIOeo33HELvNZu-SMxXYTkZNWP-S9BxXHmE_Y2KBb0VOb-mfdeG0Ni-9jv1IyyPTxjA2jIUvSJl6Hiet5QHVgk33Fn9CRe4gZb7Owc=',@iescolar Consecuencias de una ley mordaza no derogada y sindicatos radicales afines a la ultraderecha,consecuencias de una ley mordaza no derogada y sindicatos radicales afines a la ultraderecha,consequences of a non-derogable gag law and radical trade unions related to the ultra-right
